"Date","Text","Message JSON","Intent","Incoming"
"2020-01-05T19:19:40.336Z",,"{""userId"":""0fdb176b-0c66-42cc-aef1-672d81a6d0b9""}",,true
"2020-01-05T19:19:40.331Z","<div class=""avatar-container""><img src=""https://laylasgotyou.com/assets/images/layla-avatar.png"" alt=""layla"" /></div>","{""userId"":""0fdb176b-0c66-42cc-aef1-672d81a6d0b9"",""payloadJson"":{""output"":{""generic"":[{""response_type"":""text"",""text"":""<div class=\""avatar-container\""><img src=\""https://laylasgotyou.com/assets/images/layla-avatar.png\"" alt=\""layla\"" /></div>""},{""typing"":true,""response_type"":""pause"",""time"":1500},{""response_type"":""text"",""text"":""Hey girl! I’m Layla. Consider me your new best friend with all the deets about those uncomfortable topics like birth control, sex, and STDs. You know, the stuff you’re not exactly running home to talk to mom about. Ask me anything you want and I promise, it stays between me and you. Have any questions for me? I’m listening!""}],""nodes_visited"":[""Welcome"",""node_2_1541089898852""],""text"":[""<div class=\""avatar-container\""><img src=\""https://laylasgotyou.com/assets/images/layla-avatar.png\"" alt=\""layla\"" /></div>"",""Hey girl! I’m Layla. Consider me your new best friend with all the deets about those uncomfortable topics like birth control, sex, and STDs. You know, the stuff you’re not exactly running home to talk to mom about. Ask me anything you want and I promise, it stays between me and you. Have any questions for me? I’m listening!""]},""context"":{""bot_lang"":""layla"",""metadata"":{""user_id"":""0fdb176b-0c66-42cc-aef1-672d81a6d0b9""},""system"":{""dialog_request_counter"":1,""dialog_stack"":[{""dialog_node"":""root""}],""dialog_turn_counter"":1,""_node_output_map"":{""node_2_1541089898852"":{""0"":[0],""2"":[0]}},""initialized"":true,""branch_exited"":true,""branch_exited_reason"":""completed""},""bot_mode"":""web"",""conversation_id"":""b16726f5-2028-4b21-acc7-a27427ad5ceb""},""alternate_intents"":false},""text"":""<div class=\""avatar-container\""><img src=\""https://laylasgotyou.com/assets/images/layla-avatar.png\"" alt=\""layla\"" /></div>""}",,false
"2020-01-05T19:19:55.024Z","Why is my butthole itchy","{""userId"":""0fdb176b-0c66-42cc-aef1-672d81a6d0b9"",""text"":""Why is my butthole itchy""}",,true
"2020-01-05T19:19:55.012Z","If you are allergic to condoms, there are non-latex condoms you can use, and you can find them in the normal brands (like Trojan and Durex). ","{""payloadJson"":{""output"":{""generic"":[{""response_type"":""text"",""text"":""If you are allergic to condoms, there are non-latex condoms you can use, and you can find them in the normal brands (like Trojan and Durex). ""}],""nodes_visited"":[""node_35_1534975805348""],""text"":[""If you are allergic to condoms, there are non-latex condoms you can use, and you can find them in the normal brands (like Trojan and Durex). ""]},""context"":{""bot_lang"":""layla"",""metadata"":{""user_id"":""0fdb176b-0c66-42cc-aef1-672d81a6d0b9""},""system"":{""dialog_request_counter"":2,""dialog_stack"":[{""dialog_node"":""root""}],""dialog_turn_counter"":2,""_node_output_map"":{""node_2_1541089898852"":{""0"":[0],""2"":[0]},""node_35_1534975805348"":{""0"":[0]}},""initialized"":true,""branch_exited"":true,""branch_exited_reason"":""completed""},""bot_mode"":""web"",""conversation_id"":""b16726f5-2028-4b21-acc7-a27427ad5ceb""},""input"":{""text"":""Why is my butthole itchy""},""intents"":[{""intent"":""Condom.allergy"",""confidence"":0.7952376365661622}],""alternate_intents"":false},""text"":""If you are allergic to condoms, there are non-latex condoms you can use, and you can find them in the normal brands (like Trojan and Durex). "",""userId"":""0fdb176b-0c66-42cc-aef1-672d81a6d0b9"",""intent"":{""name"":""Condom.allergy""}}","Condom.allergy",false
"2020-01-05T19:22:00.396Z","How do I shave my balls without cutting them","{""userId"":""0fdb176b-0c66-42cc-aef1-672d81a6d0b9"",""text"":""How do I shave my balls without cutting them""}",,true
"2020-01-05T19:22:00.585Z","e1eb36b0-040d-4fdd-843d-ccde7dc6a3c8","{""userId"":""0fdb176b-0c66-42cc-aef1-672d81a6d0b9"",""text"":""e1eb36b0-040d-4fdd-843d-ccde7dc6a3c8""}",,true
"2020-01-05T19:22:00.396Z","The female body is seriously complicated. You have the vagina, labia, clitoris (aka the clit), and urethra that all make up the “vulva”. The clit is the sensitive bump right above your vagina that usually gets you to come.","{""payloadJson"":{""output"":{""generic"":[{""response_type"":""text"",""text"":""The female body is seriously complicated. You have the vagina, labia, clitoris (aka the clit), and urethra that all make up the “vulva”. The clit is the sensitive bump right above your vagina that usually gets you to come.""},{""response_type"":""text"",""text"":""Above the vagina (on the inside) is your uterus and that’s where the egg gets fertilized with sperm. And the cervix is the small opening between the vagina and uterus.""}],""nodes_visited"":[""node_1_1540517127549"",""node_18_1542307714292""],""text"":[""The female body is seriously complicated. You have the vagina, labia, clitoris (aka the clit), and urethra that all make up the “vulva”. The clit is the sensitive bump right above your vagina that usually gets you to come."",""Above the vagina (on the inside) is your uterus and that’s where the egg gets fertilized with sperm. And the cervix is the small opening between the vagina and uterus.""]},""context"":{""bot_lang"":""layla"",""metadata"":{""user_id"":""0fdb176b-0c66-42cc-aef1-672d81a6d0b9""},""system"":{""dialog_request_counter"":3,""dialog_stack"":[{""dialog_node"":""root""}],""dialog_turn_counter"":3,""_node_output_map"":{""node_18_1542307714292"":{""0"":[0],""1"":[0]},""node_2_1541089898852"":{""0"":[0],""2"":[0]},""node_35_1534975805348"":{""0"":[0]}},""initialized"":true,""branch_exited"":true,""branch_exited_reason"":""completed""},""bot_mode"":""web"",""conversation_id"":""b16726f5-2028-4b21-acc7-a27427ad5ceb""},""input"":{""text"":""How do I shave my balls without cutting them""},""intents"":[{""intent"":""def_vagina"",""confidence"":0.4903070211410523}],""entities"":[{""location"":[18,23],""value"":""Testicles"",""entity"":""Body_Parts"",""confidence"":1}],""alternate_intents"":false},""text"":""The female body is seriously complicated. You have the vagina, labia, clitoris (aka the clit), and urethra that all make up the “vulva”. The clit is the sensitive bump right above your vagina that usually gets you to come."",""userId"":""0fdb176b-0c66-42cc-aef1-672d81a6d0b9"",""intent"":{""name"":""def_vagina"",""inputs"":[{""name"":""Body_Parts"",""value"":""Testicles""}]}}","def_vagina",false
"2020-01-05T19:22:00.572Z","I'm sorry can you ask that some other way?","{""payloadJson"":{""output"":{""generic"":[{""response_type"":""text"",""text"":""I'm sorry can you ask that some other way?""}],""nodes_visited"":[""node_1_1540844990941""],""text"":[""I'm sorry can you ask that some other way?""]},""context"":{""bot_lang"":""layla"",""metadata"":{""user_id"":""0fdb176b-0c66-42cc-aef1-672d81a6d0b9""},""system"":{""dialog_request_counter"":4,""dialog_stack"":[{""dialog_node"":""root""}],""dialog_turn_counter"":4,""_node_output_map"":{""node_35_1534975805348"":{""0"":[0]},""node_18_1542307714292"":{""0"":[0],""1"":[0]},""node_1_1540844990941"":{""0"":[0]},""node_2_1541089898852"":{""0"":[0],""2"":[0]}},""initialized"":true,""branch_exited"":true,""branch_exited_reason"":""completed""},""bot_mode"":""web"",""conversation_id"":""b16726f5-2028-4b21-acc7-a27427ad5ceb""},""input"":{""text"":""e1eb36b0-040d-4fdd-843d-ccde7dc6a3c8""},""intents"":[{""intent"":""unknown"",""confidence"":1}],""alternate_intents"":false},""text"":""I'm sorry can you ask that some other way?"",""userId"":""0fdb176b-0c66-42cc-aef1-672d81a6d0b9"",""intent"":{""name"":""unknown""}}","unknown",false
"2020-01-05T19:22:17.530Z","How do I shave my testicles without cutting myself","{""userId"":""0fdb176b-0c66-42cc-aef1-672d81a6d0b9"",""text"":""How do I shave my testicles without cutting myself""}",,true
"2020-01-05T19:22:17.789Z","e1eb36b0-040d-4fdd-843d-ccde7dc6a3c8","{""userId"":""0fdb176b-0c66-42cc-aef1-672d81a6d0b9"",""text"":""e1eb36b0-040d-4fdd-843d-ccde7dc6a3c8""}",,true
"2020-01-05T19:22:17.546Z","I didn't understand. You can try rephrasing.","{""payloadJson"":{""output"":{""generic"":[{""response_type"":""text"",""text"":""I didn't understand. You can try rephrasing.""}],""nodes_visited"":[""Anything else""],""text"":[""I didn't understand. You can try rephrasing.""]},""context"":{""bot_lang"":""layla"",""metadata"":{""user_id"":""0fdb176b-0c66-42cc-aef1-672d81a6d0b9""},""system"":{""dialog_request_counter"":5,""dialog_stack"":[{""dialog_node"":""root""}],""dialog_turn_counter"":5,""_node_output_map"":{""Anything else"":{""0"":[0]},""node_35_1534975805348"":{""0"":[0]},""node_18_1542307714292"":{""0"":[0],""1"":[0]},""node_1_1540844990941"":{""0"":[0]},""node_2_1541089898852"":{""0"":[0],""2"":[0]}},""initialized"":true,""branch_exited"":true,""branch_exited_reason"":""completed""},""bot_mode"":""web"",""conversation_id"":""b16726f5-2028-4b21-acc7-a27427ad5ceb""},""input"":{""text"":""How do I shave my testicles without cutting myself""},""intents"":[{""intent"":""Anal.safer.than.vaginal.inquiry"",""confidence"":0.41606919765472417}],""entities"":[{""location"":[18,27],""value"":""Testicles"",""entity"":""Body_Parts"",""confidence"":1}],""alternate_intents"":false},""text"":""I didn't understand. You can try rephrasing."",""userId"":""0fdb176b-0c66-42cc-aef1-672d81a6d0b9"",""intent"":{""name"":""Anal.safer.than.vaginal.inquiry"",""inputs"":[{""name"":""Body_Parts"",""value"":""Testicles""}]}}","Anal.safer.than.vaginal.inquiry",false
"2020-01-05T19:22:17.775Z","I'm sorry can you ask that some other way?","{""payloadJson"":{""output"":{""generic"":[{""response_type"":""text"",""text"":""I'm sorry can you ask that some other way?""}],""nodes_visited"":[""node_1_1540844990941""],""text"":[""I'm sorry can you ask that some other way?""]},""context"":{""bot_lang"":""layla"",""metadata"":{""user_id"":""0fdb176b-0c66-42cc-aef1-672d81a6d0b9""},""system"":{""dialog_request_counter"":6,""dialog_stack"":[{""dialog_node"":""root""}],""dialog_turn_counter"":6,""_node_output_map"":{""Anything else"":{""0"":[0]},""node_35_1534975805348"":{""0"":[0]},""node_18_1542307714292"":{""0"":[0],""1"":[0]},""node_1_1540844990941"":{""0"":[0]},""node_2_1541089898852"":{""0"":[0],""2"":[0]}},""initialized"":true,""branch_exited"":true,""branch_exited_reason"":""completed""},""bot_mode"":""web"",""conversation_id"":""b16726f5-2028-4b21-acc7-a27427ad5ceb""},""input"":{""text"":""e1eb36b0-040d-4fdd-843d-ccde7dc6a3c8""},""intents"":[{""intent"":""unknown"",""confidence"":1}],""alternate_intents"":false},""text"":""I'm sorry can you ask that some other way?"",""userId"":""0fdb176b-0c66-42cc-aef1-672d81a6d0b9"",""intent"":{""name"":""unknown""}}","unknown",false
"2020-01-05T19:22:43.132Z","How do I shave without cutting myself","{""userId"":""0fdb176b-0c66-42cc-aef1-672d81a6d0b9"",""text"":""How do I shave without cutting myself""}",,true
"2020-01-05T19:22:43.439Z","e1eb36b0-040d-4fdd-843d-ccde7dc6a3c8","{""userId"":""0fdb176b-0c66-42cc-aef1-672d81a6d0b9"",""text"":""e1eb36b0-040d-4fdd-843d-ccde7dc6a3c8""}",,true
"2020-01-05T19:22:43.143Z","Putting on a condom can sound complicated the first time you’re trying to do it but, once you get the hang of it, it’s really easy and only takes a couple seconds. Pull it out of the wrapper and make sure the rim of the condom is on the OUTSIDE. This is important so you don’t put it on inside out.","{""payloadJson"":{""output"":{""generic"":[{""response_type"":""text"",""text"":""Putting on a condom can sound complicated the first time you’re trying to do it but, once you get the hang of it, it’s really easy and only takes a couple seconds. Pull it out of the wrapper and make sure the rim of the condom is on the OUTSIDE. This is important so you don’t put it on inside out.""},{""response_type"":""text"",""text"":""Pinch the top of the condom and put it on the head of the penis leaving some room to catch the semen. Then, you just roll it down the penis and you’re done! ""}],""nodes_visited"":[""node_13_1535564447052"",""node_21_1542649883868""],""text"":[""Putting on a condom can sound complicated the first time you’re trying to do it but, once you get the hang of it, it’s really easy and only takes a couple seconds. Pull it out of the wrapper and make sure the rim of the condom is on the OUTSIDE. This is important so you don’t put it on inside out."",""Pinch the top of the condom and put it on the head of the penis leaving some room to catch the semen. Then, you just roll it down the penis and you’re done! ""]},""context"":{""bot_lang"":""layla"",""metadata"":{""user_id"":""0fdb176b-0c66-42cc-aef1-672d81a6d0b9""},""system"":{""dialog_request_counter"":7,""dialog_stack"":[{""dialog_node"":""root""}],""dialog_turn_counter"":7,""_node_output_map"":{""Anything else"":{""0"":[0]},""node_35_1534975805348"":{""0"":[0]},""node_18_1542307714292"":{""0"":[0],""1"":[0]},""node_21_1542649883868"":{""0"":[0],""1"":[0]},""node_1_1540844990941"":{""0"":[0]},""node_2_1541089898852"":{""0"":[0],""2"":[0]}},""initialized"":true,""branch_exited"":true,""branch_exited_reason"":""completed""},""bot_mode"":""web"",""conversation_id"":""b16726f5-2028-4b21-acc7-a27427ad5ceb""},""input"":{""text"":""How do I shave without cutting myself""},""intents"":[{""intent"":""Condom.how.put.on"",""confidence"":0.3923376798629761}],""alternate_intents"":false},""text"":""Putting on a condom can sound complicated the first time you’re trying to do it but, once you get the hang of it, it’s really easy and only takes a couple seconds. Pull it out of the wrapper and make sure the rim of the condom is on the OUTSIDE. This is important so you don’t put it on inside out."",""userId"":""0fdb176b-0c66-42cc-aef1-672d81a6d0b9"",""intent"":{""name"":""Condom.how.put.on""}}","Condom.how.put.on",false
"2020-01-05T19:22:43.424Z","I'm sorry can you ask that some other way?","{""payloadJson"":{""output"":{""generic"":[{""response_type"":""text"",""text"":""I'm sorry can you ask that some other way?""}],""nodes_visited"":[""node_1_1540844990941""],""text"":[""I'm sorry can you ask that some other way?""]},""context"":{""bot_lang"":""layla"",""metadata"":{""user_id"":""0fdb176b-0c66-42cc-aef1-672d81a6d0b9""},""system"":{""dialog_request_counter"":8,""dialog_stack"":[{""dialog_node"":""root""}],""dialog_turn_counter"":8,""_node_output_map"":{""Anything else"":{""0"":[0]},""node_35_1534975805348"":{""0"":[0]},""node_18_1542307714292"":{""0"":[0],""1"":[0]},""node_21_1542649883868"":{""0"":[0],""1"":[0]},""node_1_1540844990941"":{""0"":[0]},""node_2_1541089898852"":{""0"":[0],""2"":[0]}},""initialized"":true,""branch_exited"":true,""branch_exited_reason"":""completed""},""bot_mode"":""web"",""conversation_id"":""b16726f5-2028-4b21-acc7-a27427ad5ceb""},""input"":{""text"":""e1eb36b0-040d-4fdd-843d-ccde7dc6a3c8""},""intents"":[{""intent"":""unknown"",""confidence"":1}],""alternate_intents"":false},""text"":""I'm sorry can you ask that some other way?"",""userId"":""0fdb176b-0c66-42cc-aef1-672d81a6d0b9"",""intent"":{""name"":""unknown""}}","unknown",false
"2020-01-05T19:22:56.756Z","Am I pregnant","{""userId"":""0fdb176b-0c66-42cc-aef1-672d81a6d0b9"",""text"":""Am I pregnant""}",,true
"2020-01-05T19:22:56.770Z","Finding out your pregnant can be scary af, especially if this wasn’t in the plans. You could be pregnant if your period’s late, your boobs hurt, or you feel sick to your stomach. ","{""payloadJson"":{""output"":{""generic"":[{""response_type"":""text"",""text"":""Finding out your pregnant can be scary af, especially if this wasn’t in the plans. You could be pregnant if your period’s late, your boobs hurt, or you feel sick to your stomach. ""},{""response_type"":""text"",""text"":""If you miss your period, you should take a pregnancy test ASAP. You can get them pretty much at any grocery store or pharmacy and you don’t have to be 18 or have your parent’s permission. If you ARE pregnant, take a deep breath and know that you have options. There are a lot of people who can help you right now.""},{""response_type"":""text"",""text"":""Make that doctor’s appointment ASAP to figure out the next best move for YOU. Check out <a target=\""_blank\"" href=\""https://www.plannedparenthood.org/health-center/new-york/syracuse/13210/syracuse-health-center-2471-91040/\"">Planned Parenthood</a> or <a target=\""_blank\"" href=\""http://www.smnfswcc.org/family-planning.aspx\"">Family Planning Service</a> if you're not sure where to go. ""}],""nodes_visited"":[""node_15_1534542928376"",""node_11_1541715692703""],""text"":[""Finding out your pregnant can be scary af, especially if this wasn’t in the plans. You could be pregnant if your period’s late, your boobs hurt, or you feel sick to your stomach. "",""If you miss your period, you should take a pregnancy test ASAP. You can get them pretty much at any grocery store or pharmacy and you don’t have to be 18 or have your parent’s permission. If you ARE pregnant, take a deep breath and know that you have options. There are a lot of people who can help you right now."",""Make that doctor’s appointment ASAP to figure out the next best move for YOU. Check out <a target=\""_blank\"" href=\""https://www.plannedparenthood.org/health-center/new-york/syracuse/13210/syracuse-health-center-2471-91040/\"">Planned Parenthood</a> or <a target=\""_blank\"" href=\""http://www.smnfswcc.org/family-planning.aspx\"">Family Planning Service</a> if you're not sure where to go. ""]},""context"":{""bot_lang"":""layla"",""metadata"":{""user_id"":""0fdb176b-0c66-42cc-aef1-672d81a6d0b9""},""system"":{""dialog_request_counter"":9,""dialog_stack"":[{""dialog_node"":""root""}],""dialog_turn_counter"":9,""_node_output_map"":{""Anything else"":{""0"":[0]},""node_35_1534975805348"":{""0"":[0]},""node_21_1542649883868"":{""0"":[0],""1"":[0]},""node_1_1540844990941"":{""0"":[0]},""node_11_1541715692703"":{""0"":[0],""1"":[0],""2"":[0]},""node_18_1542307714292"":{""0"":[0],""1"":[0]},""node_2_1541089898852"":{""0"":[0],""2"":[0]}},""initialized"":true,""branch_exited"":true,""branch_exited_reason"":""completed""},""bot_mode"":""web"",""conversation_id"":""b16726f5-2028-4b21-acc7-a27427ad5ceb""},""input"":{""text"":""Am I pregnant""},""intents"":[{""intent"":""Preg.know"",""confidence"":0.8431068420410157}],""entities"":[{""location"":[5,13],""value"":""pregnant"",""entity"":""Pregnant"",""confidence"":1}],""alternate_intents"":false},""text"":""Finding out your pregnant can be scary af, especially if this wasn’t in the plans. You could be pregnant if your period’s late, your boobs hurt, or you feel sick to your stomach. "",""userId"":""0fdb176b-0c66-42cc-aef1-672d81a6d0b9"",""intent"":{""name"":""Preg.know"",""inputs"":[{""name"":""Pregnant"",""value"":""pregnant""}]}}","Preg.know",false
"2020-01-05T19:23:04.818Z","How old am i","{""userId"":""0fdb176b-0c66-42cc-aef1-672d81a6d0b9"",""text"":""How old am i""}",,true
"2020-01-05T19:23:04.819Z","I’m Layla. I'm here to share everything I know about birth control, sex, and STDs. You can ask me anything. I’ll keep it real so you know how to take control of your body and sexual health.","{""payloadJson"":{""output"":{""generic"":[{""response_type"":""text"",""text"":""I’m Layla. I'm here to share everything I know about birth control, sex, and STDs. You can ask me anything. I’ll keep it real so you know how to take control of your body and sexual health.""}],""nodes_visited"":[""node_1_1537562400575"",""node_6_1541456258413""],""text"":[""I’m Layla. I'm here to share everything I know about birth control, sex, and STDs. You can ask me anything. I’ll keep it real so you know how to take control of your body and sexual health.""]},""context"":{""bot_lang"":""layla"",""metadata"":{""user_id"":""0fdb176b-0c66-42cc-aef1-672d81a6d0b9""},""system"":{""dialog_request_counter"":10,""dialog_stack"":[{""dialog_node"":""root""}],""dialog_turn_counter"":10,""_node_output_map"":{""node_6_1541456258413"":{""0"":[0,0]},""Anything else"":{""0"":[0]},""node_35_1534975805348"":{""0"":[0]},""node_21_1542649883868"":{""0"":[0],""1"":[0]},""node_1_1540844990941"":{""0"":[0]},""node_11_1541715692703"":{""0"":[0],""1"":[0],""2"":[0]},""node_18_1542307714292"":{""0"":[0],""1"":[0]},""node_2_1541089898852"":{""0"":[0],""2"":[0]}},""initialized"":true,""branch_exited"":true,""branch_exited_reason"":""completed""},""bot_mode"":""web"",""conversation_id"":""b16726f5-2028-4b21-acc7-a27427ad5ceb""},""input"":{""text"":""How old am i""},""intents"":[{""intent"":""Who.Are.You"",""confidence"":0.3213066577911377}],""alternate_intents"":false},""text"":""I’m Layla. I'm here to share everything I know about birth control, sex, and STDs. You can ask me anything. I’ll keep it real so you know how to take control of your body and sexual health."",""userId"":""0fdb176b-0c66-42cc-aef1-672d81a6d0b9"",""intent"":{""name"":""Who.Are.You""}}","Who.Are.You",false
"2020-01-05T19:23:05.094Z","e1eb36b0-040d-4fdd-843d-ccde7dc6a3c8","{""userId"":""0fdb176b-0c66-42cc-aef1-672d81a6d0b9"",""text"":""e1eb36b0-040d-4fdd-843d-ccde7dc6a3c8""}",,true
"2020-01-05T19:23:05.080Z","I'm sorry can you ask that some other way?","{""payloadJson"":{""output"":{""generic"":[{""response_type"":""text"",""text"":""I'm sorry can you ask that some other way?""}],""nodes_visited"":[""node_1_1540844990941""],""text"":[""I'm sorry can you ask that some other way?""]},""context"":{""bot_lang"":""layla"",""metadata"":{""user_id"":""0fdb176b-0c66-42cc-aef1-672d81a6d0b9""},""system"":{""dialog_request_counter"":11,""dialog_stack"":[{""dialog_node"":""root""}],""dialog_turn_counter"":11,""_node_output_map"":{""node_6_1541456258413"":{""0"":[0,0]},""Anything else"":{""0"":[0]},""node_35_1534975805348"":{""0"":[0]},""node_21_1542649883868"":{""0"":[0],""1"":[0]},""node_1_1540844990941"":{""0"":[0]},""node_11_1541715692703"":{""0"":[0],""1"":[0],""2"":[0]},""node_18_1542307714292"":{""0"":[0],""1"":[0]},""node_2_1541089898852"":{""0"":[0],""2"":[0]}},""initialized"":true,""branch_exited"":true,""branch_exited_reason"":""completed""},""bot_mode"":""web"",""conversation_id"":""b16726f5-2028-4b21-acc7-a27427ad5ceb""},""input"":{""text"":""e1eb36b0-040d-4fdd-843d-ccde7dc6a3c8""},""intents"":[{""intent"":""unknown"",""confidence"":1}],""alternate_intents"":false},""text"":""I'm sorry can you ask that some other way?"",""userId"":""0fdb176b-0c66-42cc-aef1-672d81a6d0b9"",""intent"":{""name"":""unknown""}}","unknown",false
"2020-01-05T19:23:10.845Z","How old are you","{""userId"":""0fdb176b-0c66-42cc-aef1-672d81a6d0b9"",""text"":""How old are you""}",,true
"2020-01-05T19:23:10.859Z","I’m Layla. I'm here to share everything I know about birth control, sex, and STDs. You can ask me anything. I’ll keep it real so you know how to take control of your body and sexual health.","{""payloadJson"":{""output"":{""generic"":[{""response_type"":""text"",""text"":""I’m Layla. I'm here to share everything I know about birth control, sex, and STDs. You can ask me anything. I’ll keep it real so you know how to take control of your body and sexual health.""}],""nodes_visited"":[""node_1_1537562400575"",""node_6_1541456258413""],""text"":[""I’m Layla. I'm here to share everything I know about birth control, sex, and STDs. You can ask me anything. I’ll keep it real so you know how to take control of your body and sexual health.""]},""context"":{""bot_lang"":""layla"",""metadata"":{""user_id"":""0fdb176b-0c66-42cc-aef1-672d81a6d0b9""},""system"":{""dialog_request_counter"":12,""dialog_stack"":[{""dialog_node"":""root""}],""dialog_turn_counter"":12,""_node_output_map"":{""node_6_1541456258413"":{""0"":[0,0]},""Anything else"":{""0"":[0]},""node_35_1534975805348"":{""0"":[0]},""node_21_1542649883868"":{""0"":[0],""1"":[0]},""node_1_1540844990941"":{""0"":[0]},""node_11_1541715692703"":{""0"":[0],""1"":[0],""2"":[0]},""node_18_1542307714292"":{""0"":[0],""1"":[0]},""node_2_1541089898852"":{""0"":[0],""2"":[0]}},""initialized"":true,""branch_exited"":true,""branch_exited_reason"":""completed""},""bot_mode"":""web"",""conversation_id"":""b16726f5-2028-4b21-acc7-a27427ad5ceb""},""input"":{""text"":""How old are you""},""intents"":[{""intent"":""Who.Are.You"",""confidence"":1}],""alternate_intents"":false},""text"":""I’m Layla. I'm here to share everything I know about birth control, sex, and STDs. You can ask me anything. I’ll keep it real so you know how to take control of your body and sexual health."",""userId"":""0fdb176b-0c66-42cc-aef1-672d81a6d0b9"",""intent"":{""name"":""Who.Are.You""}}","Who.Are.You",false
"2020-01-05T19:23:22.505Z","What is doggy style","{""userId"":""0fdb176b-0c66-42cc-aef1-672d81a6d0b9"",""text"":""What is doggy style""}",,true
"2020-01-05T19:23:22.757Z","e1eb36b0-040d-4fdd-843d-ccde7dc6a3c8","{""userId"":""0fdb176b-0c66-42cc-aef1-672d81a6d0b9"",""text"":""e1eb36b0-040d-4fdd-843d-ccde7dc6a3c8""}",,true
