"Date","Text","Message JSON","Intent","Incoming"
"2020-01-05T11:15:35.895Z","I'm sorry can you ask that some other way?","{""payloadJson"":{""output"":{""generic"":[{""response_type"":""text"",""text"":""I'm sorry can you ask that some other way?""}],""nodes_visited"":[""node_1_1540844990941""],""text"":[""I'm sorry can you ask that some other way?""]},""context"":{""bot_lang"":""layla"",""metadata"":{""user_id"":""4757796f-41fd-43c8-af3e-1ab70d6e6c0b""},""system"":{""dialog_request_counter"":10,""dialog_stack"":[{""dialog_node"":""root""}],""dialog_turn_counter"":10,""_node_output_map"":{""node_22_1542665776850"":{""0"":[0],""1"":[0]},""node_1_1541103168854"":{""0"":[0]},""node_1_1540844990941"":{""0"":[0]},""node_8_1541456654510"":{""0"":[0]},""node_1_1544810991157"":{""1"":[1,5,1,0,4,3,6,2]},""node_1_1556755579683"":{""0"":[0]},""node_26_1541630799961"":{""0"":[0],""1"":[0],""4"":[0]},""node_2_1541089898852"":{""0"":[0],""2"":[0]},""node_18_1541092071873"":{""0"":[0],""1"":[0]}},""initialized"":true,""branch_exited"":true,""branch_exited_reason"":""completed""},""bot_mode"":""web"",""conversation_id"":""668d99c7-499c-4cdf-b4e6-d945eddebe00""},""input"":{""text"":""e1eb36b0-040d-4fdd-843d-ccde7dc6a3c8""},""intents"":[{""intent"":""unknown"",""confidence"":1}],""alternate_intents"":false},""text"":""I'm sorry can you ask that some other way?"",""userId"":""4757796f-41fd-43c8-af3e-1ab70d6e6c0b"",""intent"":{""name"":""unknown""}}","unknown",false
"2020-01-05T11:16:26.292Z","How do you masturbate correctly","{""userId"":""4757796f-41fd-43c8-af3e-1ab70d6e6c0b"",""text"":""How do you masturbate correctly""}",,true
"2020-01-05T11:16:26.292Z","You've probably heard about masturbation - touching yourself for sexual pleasure. Almost everybody masturbates. But we don't talk about it because it makes people feel uncomfortable. It's totally normal for both boys AND girls to masturbate at any age. And some people don't masturbate at all. Do whatever makes YOU feel comfortable.","{""payloadJson"":{""output"":{""generic"":[{""response_type"":""text"",""text"":""You've probably heard about masturbation - touching yourself for sexual pleasure. Almost everybody masturbates. But we don't talk about it because it makes people feel uncomfortable. It's totally normal for both boys AND girls to masturbate at any age. And some people don't masturbate at all. Do whatever makes YOU feel comfortable.""}],""nodes_visited"":[""node_2_1556809489992""],""text"":[""You've probably heard about masturbation - touching yourself for sexual pleasure. Almost everybody masturbates. But we don't talk about it because it makes people feel uncomfortable. It's totally normal for both boys AND girls to masturbate at any age. And some people don't masturbate at all. Do whatever makes YOU feel comfortable.""]},""context"":{""bot_lang"":""layla"",""metadata"":{""user_id"":""4757796f-41fd-43c8-af3e-1ab70d6e6c0b""},""system"":{""dialog_request_counter"":11,""dialog_stack"":[{""dialog_node"":""root""}],""dialog_turn_counter"":11,""_node_output_map"":{""node_22_1542665776850"":{""0"":[0],""1"":[0]},""node_1_1541103168854"":{""0"":[0]},""node_1_1540844990941"":{""0"":[0]},""node_2_1556809489992"":{""0"":[0]},""node_8_1541456654510"":{""0"":[0]},""node_1_1544810991157"":{""1"":[1,5,1,0,4,3,6,2]},""node_1_1556755579683"":{""0"":[0]},""node_26_1541630799961"":{""0"":[0],""1"":[0],""4"":[0]},""node_2_1541089898852"":{""0"":[0],""2"":[0]},""node_18_1541092071873"":{""0"":[0],""1"":[0]}},""initialized"":true,""branch_exited"":true,""branch_exited_reason"":""completed""},""bot_mode"":""web"",""conversation_id"":""668d99c7-499c-4cdf-b4e6-d945eddebe00""},""input"":{""text"":""How do you masturbate correctly""},""intents"":[{""intent"":""Masturbation"",""confidence"":0.9269002914428712}],""alternate_intents"":false},""text"":""You've probably heard about masturbation - touching yourself for sexual pleasure. Almost everybody masturbates. But we don't talk about it because it makes people feel uncomfortable. It's totally normal for both boys AND girls to masturbate at any age. And some people don't masturbate at all. Do whatever makes YOU feel comfortable."",""userId"":""4757796f-41fd-43c8-af3e-1ab70d6e6c0b"",""intent"":{""name"":""Masturbation""}}","Masturbation",false
"2020-01-05T11:17:05.604Z","Is it okay to get sex toys at 14","{""userId"":""4757796f-41fd-43c8-af3e-1ab70d6e6c0b"",""text"":""Is it okay to get sex toys at 14""}",,true
"2020-01-05T11:17:05.587Z","You can only get pregnant from sex toys if the toy has semen (cum) on it, and you put it into your vagina. It's always a good idea to keep sex toys clean.","{""payloadJson"":{""output"":{""generic"":[{""response_type"":""text"",""text"":""You can only get pregnant from sex toys if the toy has semen (cum) on it, and you put it into your vagina. It's always a good idea to keep sex toys clean.""}],""nodes_visited"":[""node_27_1535575819516""],""text"":[""You can only get pregnant from sex toys if the toy has semen (cum) on it, and you put it into your vagina. It's always a good idea to keep sex toys clean.""]},""context"":{""bot_lang"":""layla"",""metadata"":{""user_id"":""4757796f-41fd-43c8-af3e-1ab70d6e6c0b""},""system"":{""dialog_request_counter"":12,""dialog_stack"":[{""dialog_node"":""root""}],""dialog_turn_counter"":12,""_node_output_map"":{""node_22_1542665776850"":{""0"":[0],""1"":[0]},""node_1_1541103168854"":{""0"":[0]},""node_1_1540844990941"":{""0"":[0]},""node_27_1535575819516"":{""0"":[0]},""node_2_1556809489992"":{""0"":[0]},""node_8_1541456654510"":{""0"":[0]},""node_1_1544810991157"":{""1"":[1,5,1,0,4,3,6,2]},""node_1_1556755579683"":{""0"":[0]},""node_26_1541630799961"":{""0"":[0],""1"":[0],""4"":[0]},""node_2_1541089898852"":{""0"":[0],""2"":[0]},""node_18_1541092071873"":{""0"":[0],""1"":[0]}},""initialized"":true,""branch_exited"":true,""branch_exited_reason"":""completed""},""bot_mode"":""web"",""conversation_id"":""668d99c7-499c-4cdf-b4e6-d945eddebe00""},""input"":{""text"":""Is it okay to get sex toys at 14""},""intents"":[{""intent"":""Preg.from.toys"",""confidence"":0.8484891414642335}],""entities"":[{""location"":[18,21],""value"":""sex"",""entity"":""Sex"",""confidence"":1},{""location"":[30,32],""metadata"":{""numeric_value"":14},""value"":""14"",""entity"":""sys-number"",""confidence"":1}],""alternate_intents"":false},""text"":""You can only get pregnant from sex toys if the toy has semen (cum) on it, and you put it into your vagina. It's always a good idea to keep sex toys clean."",""userId"":""4757796f-41fd-43c8-af3e-1ab70d6e6c0b"",""intent"":{""name"":""Preg.from.toys"",""inputs"":[{""name"":""Sex"",""value"":""sex""},{""name"":""sys-number"",""value"":""14""}]}}","Preg.from.toys",false
"2020-01-05T11:17:27.856Z","What is the best sex toy","{""userId"":""4757796f-41fd-43c8-af3e-1ab70d6e6c0b"",""text"":""What is the best sex toy""}",,true
"2020-01-05T11:17:27.857Z","Sex is one of those things where EVERYONE has their own opinion on what it means to them. If we’re talking technically though, different kinds of sex have different meanings.","{""payloadJson"":{""output"":{""generic"":[{""response_type"":""text"",""text"":""Sex is one of those things where EVERYONE has their own opinion on what it means to them. If we’re talking technically though, different kinds of sex have different meanings.""},{""response_type"":""text"",""text"":""Oral sex (giving head or a blow job) is when you use your mouth on someone’s vagina or penis. Anal sex is when a penis enters the butt. And sex (which your doctor might call sexual intercourse) is when a penis enters the vagina. All sex, all different kinds of ways to do it. ""}],""nodes_visited"":[""node_9_1535648906411"",""node_8_1542402954441""],""text"":[""Sex is one of those things where EVERYONE has their own opinion on what it means to them. If we’re talking technically though, different kinds of sex have different meanings."",""Oral sex (giving head or a blow job) is when you use your mouth on someone’s vagina or penis. Anal sex is when a penis enters the butt. And sex (which your doctor might call sexual intercourse) is when a penis enters the vagina. All sex, all different kinds of ways to do it. ""]},""context"":{""bot_lang"":""layla"",""metadata"":{""user_id"":""4757796f-41fd-43c8-af3e-1ab70d6e6c0b""},""system"":{""dialog_request_counter"":13,""dialog_stack"":[{""dialog_node"":""root""}],""dialog_turn_counter"":13,""_node_output_map"":{""node_22_1542665776850"":{""0"":[0],""1"":[0]},""node_1_1541103168854"":{""0"":[0]},""node_1_1540844990941"":{""0"":[0]},""node_27_1535575819516"":{""0"":[0]},""node_8_1542402954441"":{""0"":[0],""1"":[0]},""node_2_1556809489992"":{""0"":[0]},""node_8_1541456654510"":{""0"":[0]},""node_1_1544810991157"":{""1"":[1,5,1,0,4,3,6,2]},""node_1_1556755579683"":{""0"":[0]},""node_26_1541630799961"":{""0"":[0],""1"":[0],""4"":[0]},""node_2_1541089898852"":{""0"":[0],""2"":[0]},""node_18_1541092071873"":{""0"":[0],""1"":[0]}},""initialized"":true,""branch_exited"":true,""branch_exited_reason"":""completed""},""bot_mode"":""web"",""conversation_id"":""668d99c7-499c-4cdf-b4e6-d945eddebe00""},""input"":{""text"":""What is the best sex toy""},""intents"":[{""intent"":""def_sex"",""confidence"":0.7434394359588623}],""entities"":[{""location"":[17,20],""value"":""sex"",""entity"":""Sex"",""confidence"":1}],""alternate_intents"":false},""text"":""Sex is one of those things where EVERYONE has their own opinion on what it means to them. If we’re talking technically though, different kinds of sex have different meanings."",""userId"":""4757796f-41fd-43c8-af3e-1ab70d6e6c0b"",""intent"":{""name"":""def_sex"",""inputs"":[{""name"":""Sex"",""value"":""sex""}]}}","def_sex",false
"2020-01-05T11:18:14.773Z","Can you have sex on your period","{""userId"":""4757796f-41fd-43c8-af3e-1ab70d6e6c0b"",""text"":""Can you have sex on your period""}",,true
"2020-01-05T11:18:14.756Z","You can get pregnant any time you have sex. This means at any time during the month, even on your period. Sperm can survive up to 5 DAYS in a woman’s body so even towards the end of your period, you’re risking pregnancy. ","{""payloadJson"":{""output"":{""generic"":[{""response_type"":""text"",""text"":""You can get pregnant any time you have sex. This means at any time during the month, even on your period. Sperm can survive up to 5 DAYS in a woman’s body so even towards the end of your period, you’re risking pregnancy. ""},{""response_type"":""text"",""text"":""If you don’t want to get pregnant, use birth control so you can have sex whenever you want 😃.""}],""nodes_visited"":[""node_2_1534536009510"",""node_4_1541708593861""],""text"":[""You can get pregnant any time you have sex. This means at any time during the month, even on your period. Sperm can survive up to 5 DAYS in a woman’s body so even towards the end of your period, you’re risking pregnancy. "",""If you don’t want to get pregnant, use birth control so you can have sex whenever you want 😃.""]},""context"":{""bot_lang"":""layla"",""metadata"":{""user_id"":""4757796f-41fd-43c8-af3e-1ab70d6e6c0b""},""system"":{""dialog_request_counter"":14,""dialog_stack"":[{""dialog_node"":""root""}],""dialog_turn_counter"":14,""_node_output_map"":{""node_22_1542665776850"":{""0"":[0],""1"":[0]},""node_4_1541708593861"":{""0"":[0],""1"":[0]},""node_27_1535575819516"":{""0"":[0]},""node_2_1556809489992"":{""0"":[0]},""node_18_1541092071873"":{""0"":[0],""1"":[0]},""node_1_1541103168854"":{""0"":[0]},""node_1_1540844990941"":{""0"":[0]},""node_8_1542402954441"":{""0"":[0],""1"":[0]},""node_8_1541456654510"":{""0"":[0]},""node_1_1544810991157"":{""1"":[1,5,1,0,4,3,6,2]},""node_1_1556755579683"":{""0"":[0]},""node_26_1541630799961"":{""0"":[0],""1"":[0],""4"":[0]},""node_2_1541089898852"":{""0"":[0],""2"":[0]}},""initialized"":true,""branch_exited"":true,""branch_exited_reason"":""completed""},""bot_mode"":""web"",""conversation_id"":""668d99c7-499c-4cdf-b4e6-d945eddebe00""},""input"":{""text"":""Can you have sex on your period""},""intents"":[{""intent"":""Preg.time"",""confidence"":0.8373640060424805}],""entities"":[{""location"":[13,16],""value"":""sex"",""entity"":""Sex"",""confidence"":1},{""location"":[25,31],""value"":""period"",""entity"":""Period"",""confidence"":1}],""alternate_intents"":false},""text"":""You can get pregnant any time you have sex. This means at any time during the month, even on your period. Sperm can survive up to 5 DAYS in a woman’s body so even towards the end of your period, you’re risking pregnancy. "",""userId"":""4757796f-41fd-43c8-af3e-1ab70d6e6c0b"",""intent"":{""name"":""Preg.time"",""inputs"":[{""name"":""Sex"",""value"":""sex""},{""name"":""Period"",""value"":""period""}]}}","Preg.time",false