"Date","Text","Message JSON","Intent","Incoming"
"2020-01-05T16:17:33.959Z",,"{""userId"":""76abb255-d4ba-4562-bc23-f533e264eca1""}",,true
"2020-01-05T16:17:33.959Z","<div class=""avatar-container""><img src=""https://laylasgotyou.com/assets/images/layla-avatar.png"" alt=""layla"" /></div>","{""userId"":""76abb255-d4ba-4562-bc23-f533e264eca1"",""payloadJson"":{""output"":{""generic"":[{""response_type"":""text"",""text"":""<div class=\""avatar-container\""><img src=\""https://laylasgotyou.com/assets/images/layla-avatar.png\"" alt=\""layla\"" /></div>""},{""typing"":true,""response_type"":""pause"",""time"":1500},{""response_type"":""text"",""text"":""Hey girl! I’m Layla. Consider me your new best friend with all the deets about those uncomfortable topics like birth control, sex, and STDs. You know, the stuff you’re not exactly running home to talk to mom about. Ask me anything you want and I promise, it stays between me and you. Have any questions for me? I’m listening!""}],""nodes_visited"":[""Welcome"",""node_2_1541089898852""],""text"":[""<div class=\""avatar-container\""><img src=\""https://laylasgotyou.com/assets/images/layla-avatar.png\"" alt=\""layla\"" /></div>"",""Hey girl! I’m Layla. Consider me your new best friend with all the deets about those uncomfortable topics like birth control, sex, and STDs. You know, the stuff you’re not exactly running home to talk to mom about. Ask me anything you want and I promise, it stays between me and you. Have any questions for me? I’m listening!""]},""context"":{""bot_lang"":""layla"",""metadata"":{""user_id"":""76abb255-d4ba-4562-bc23-f533e264eca1""},""system"":{""dialog_request_counter"":1,""dialog_stack"":[{""dialog_node"":""root""}],""dialog_turn_counter"":1,""_node_output_map"":{""node_2_1541089898852"":{""0"":[0],""2"":[0]}},""initialized"":true,""branch_exited"":true,""branch_exited_reason"":""completed""},""bot_mode"":""web"",""conversation_id"":""85d29710-abe9-462f-820e-c6b27ffb1811""},""alternate_intents"":false},""text"":""<div class=\""avatar-container\""><img src=\""https://laylasgotyou.com/assets/images/layla-avatar.png\"" alt=\""layla\"" /></div>""}",,false
"2020-01-05T16:18:55.033Z","If I’m on the shot can I still get pregnant ","{""userId"":""76abb255-d4ba-4562-bc23-f533e264eca1"",""text"":""If I’m on the shot can I still get pregnant ""}",,true
"2020-01-05T16:18:55.334Z","e1eb36b0-040d-4fdd-843d-ccde7dc6a3c8","{""userId"":""76abb255-d4ba-4562-bc23-f533e264eca1"",""text"":""e1eb36b0-040d-4fdd-843d-ccde7dc6a3c8""}",,true
"2020-01-05T16:18:55.033Z","For most women, the shot (Depo) is 94% effective. So out of 100 women on the shot, 6 of them will get pregnant.","{""payloadJson"":{""output"":{""generic"":[{""response_type"":""text"",""text"":""For most women, the shot (Depo) is 94% effective. So out of 100 women on the shot, 6 of them will get pregnant.""},{""typing"":true,""response_type"":""pause"",""time"":5000},{""response_type"":""text"",""text"":""<a target=\""_blank\"" href=\""https://laylasgotyou.com/clinic-map\"">Tap here to go to the Clinic Map for your nearest doctor or clinic. </a>""}],""nodes_visited"":[""node_19_1534965066479"",""node_10_1542306707084"",""node_2_1539890504026"",""node_3_1544835959501""],""text"":[""For most women, the shot (Depo) is 94% effective. So out of 100 women on the shot, 6 of them will get pregnant."",""<a target=\""_blank\"" href=\""https://laylasgotyou.com/clinic-map\"">Tap here to go to the Clinic Map for your nearest doctor or clinic. </a>""]},""context"":{""bot_lang"":""layla"",""metadata"":{""user_id"":""76abb255-d4ba-4562-bc23-f533e264eca1""},""system"":{""dialog_request_counter"":3,""dialog_stack"":[{""dialog_node"":""root""}],""dialog_turn_counter"":3,""_node_output_map"":{""node_3_1544835959501"":{""1"":[0,3,0,1,4,2]},""node_2_1541089898852"":{""0"":[0],""2"":[0]},""node_10_1542306707084"":{""0"":[0]},""node_4_1541090288675"":{""0"":[0]}},""initialized"":true,""branch_exited"":true,""branch_exited_reason"":""completed""},""bot_mode"":""web"",""conversation_id"":""85d29710-abe9-462f-820e-c6b27ffb1811""},""input"":{""text"":""If I’m on the shot can I still get pregnant ""},""intents"":[{""intent"":""Depo.efficacy"",""confidence"":0.434375}],""entities"":[{""location"":[10,18],""value"":""Shot"",""entity"":""Birth_Control"",""confidence"":1},{""location"":[35,43],""value"":""pregnant"",""entity"":""Pregnant"",""confidence"":1}],""alternate_intents"":false},""text"":""For most women, the shot (Depo) is 94% effective. So out of 100 women on the shot, 6 of them will get pregnant."",""userId"":""76abb255-d4ba-4562-bc23-f533e264eca1"",""intent"":{""name"":""Depo.efficacy"",""inputs"":[{""name"":""Birth_Control"",""value"":""Shot""},{""name"":""Pregnant"",""value"":""pregnant""}]}}","Depo.efficacy",false
"2020-01-05T16:18:55.323Z","I'm sorry can you ask that some other way?","{""payloadJson"":{""output"":{""generic"":[{""response_type"":""text"",""text"":""I'm sorry can you ask that some other way?""}],""nodes_visited"":[""node_1_1540844990941""],""text"":[""I'm sorry can you ask that some other way?""]},""context"":{""bot_lang"":""layla"",""metadata"":{""user_id"":""76abb255-d4ba-4562-bc23-f533e264eca1""},""system"":{""dialog_request_counter"":4,""dialog_stack"":[{""dialog_node"":""root""}],""dialog_turn_counter"":4,""_node_output_map"":{""node_3_1544835959501"":{""1"":[0,3,0,1,4,2]},""node_1_1540844990941"":{""0"":[0]},""node_2_1541089898852"":{""0"":[0],""2"":[0]},""node_10_1542306707084"":{""0"":[0]},""node_4_1541090288675"":{""0"":[0]}},""initialized"":true,""branch_exited"":true,""branch_exited_reason"":""completed""},""bot_mode"":""web"",""conversation_id"":""85d29710-abe9-462f-820e-c6b27ffb1811""},""input"":{""text"":""e1eb36b0-040d-4fdd-843d-ccde7dc6a3c8""},""intents"":[{""intent"":""unknown"",""confidence"":1}],""alternate_intents"":false},""text"":""I'm sorry can you ask that some other way?"",""userId"":""76abb255-d4ba-4562-bc23-f533e264eca1"",""intent"":{""name"":""unknown""}}","unknown",false
"2020-01-05T16:19:15.264Z","If I’m on birth control can I still get pregnant ","{""userId"":""76abb255-d4ba-4562-bc23-f533e264eca1"",""text"":""If I’m on birth control can I still get pregnant ""}",,true
"2020-01-05T16:19:15.281Z","You can get pregnant any time you have sex. This means at any time during the month, even on your period. Sperm can survive up to 5 DAYS in a woman’s body so even towards the end of your period, you’re risking pregnancy. ","{""payloadJson"":{""output"":{""generic"":[{""response_type"":""text"",""text"":""You can get pregnant any time you have sex. This means at any time during the month, even on your period. Sperm can survive up to 5 DAYS in a woman’s body so even towards the end of your period, you’re risking pregnancy. ""},{""response_type"":""text"",""text"":""If you don’t want to get pregnant, use birth control so you can have sex whenever you want 😃.""}],""nodes_visited"":[""node_2_1534536009510"",""node_4_1541708593861""],""text"":[""You can get pregnant any time you have sex. This means at any time during the month, even on your period. Sperm can survive up to 5 DAYS in a woman’s body so even towards the end of your period, you’re risking pregnancy. "",""If you don’t want to get pregnant, use birth control so you can have sex whenever you want 😃.""]},""context"":{""bot_lang"":""layla"",""metadata"":{""user_id"":""76abb255-d4ba-4562-bc23-f533e264eca1""},""system"":{""dialog_request_counter"":5,""dialog_stack"":[{""dialog_node"":""root""}],""dialog_turn_counter"":5,""_node_output_map"":{""node_3_1544835959501"":{""1"":[0,3,0,1,4,2]},""node_1_1540844990941"":{""0"":[0]},""node_4_1541708593861"":{""0"":[0],""1"":[0]},""node_2_1541089898852"":{""0"":[0],""2"":[0]},""node_10_1542306707084"":{""0"":[0]},""node_4_1541090288675"":{""0"":[0]}},""initialized"":true,""branch_exited"":true,""branch_exited_reason"":""completed""},""bot_mode"":""web"",""conversation_id"":""85d29710-abe9-462f-820e-c6b27ffb1811""},""input"":{""text"":""If I’m on birth control can I still get pregnant ""},""intents"":[{""intent"":""Preg.time"",""confidence"":0.647067165374756}],""entities"":[{""location"":[10,23],""value"":""birth control"",""entity"":""Birth_Control"",""confidence"":1},{""location"":[40,48],""value"":""pregnant"",""entity"":""Pregnant"",""confidence"":1}],""alternate_intents"":false},""text"":""You can get pregnant any time you have sex. This means at any time during the month, even on your period. Sperm can survive up to 5 DAYS in a woman’s body so even towards the end of your period, you’re risking pregnancy. "",""userId"":""76abb255-d4ba-4562-bc23-f533e264eca1"",""intent"":{""name"":""Preg.time"",""inputs"":[{""name"":""Birth_Control"",""value"":""birth control""},{""name"":""Pregnant"",""value"":""pregnant""}]}}","Preg.time",false