"Date","Text","Message JSON","Intent","Incoming"
"2020-01-09T21:37:44.311Z",,"{""userId"":""928993ef-a982-4282-8082-fcf9b5704e2b""}",,true
"2020-01-09T21:37:44.312Z","<div class=""avatar-container""><img src=""https://laylasgotyou.com/assets/images/layla-avatar.png"" alt=""layla"" /></div>","{""userId"":""928993ef-a982-4282-8082-fcf9b5704e2b"",""payloadJson"":{""output"":{""generic"":[{""response_type"":""text"",""text"":""<div class=\""avatar-container\""><img src=\""https://laylasgotyou.com/assets/images/layla-avatar.png\"" alt=\""layla\"" /></div>""},{""typing"":true,""response_type"":""pause"",""time"":1500},{""response_type"":""text"",""text"":""Hey girl! I’m Layla. Consider me your new best friend with all the deets about those uncomfortable topics like birth control, sex, and STDs. You know, the stuff you’re not exactly running home to talk to mom about. Ask me anything you want and I promise, it stays between me and you. Have any questions for me? I’m listening!""}],""nodes_visited"":[""Welcome"",""node_2_1541089898852""],""text"":[""<div class=\""avatar-container\""><img src=\""https://laylasgotyou.com/assets/images/layla-avatar.png\"" alt=\""layla\"" /></div>"",""Hey girl! I’m Layla. Consider me your new best friend with all the deets about those uncomfortable topics like birth control, sex, and STDs. You know, the stuff you’re not exactly running home to talk to mom about. Ask me anything you want and I promise, it stays between me and you. Have any questions for me? I’m listening!""]},""context"":{""bot_lang"":""layla"",""metadata"":{""user_id"":""928993ef-a982-4282-8082-fcf9b5704e2b""},""system"":{""dialog_request_counter"":1,""dialog_stack"":[{""dialog_node"":""root""}],""dialog_turn_counter"":1,""_node_output_map"":{""node_2_1541089898852"":{""0"":[0],""2"":[0]}},""initialized"":true,""branch_exited"":true,""branch_exited_reason"":""completed""},""bot_mode"":""web"",""conversation_id"":""8673f00b-ad03-4fe5-afb9-5aacad125541""},""alternate_intents"":false},""text"":""<div class=\""avatar-container\""><img src=\""https://laylasgotyou.com/assets/images/layla-avatar.png\"" alt=\""layla\"" /></div>""}",,false
"2020-01-09T21:38:35.132Z","Today I starting bleeding like it was water coming out of the faucet. I had an iud put in and I recently had an abortion... should I worry ","{""userId"":""928993ef-a982-4282-8082-fcf9b5704e2b"",""text"":""Today I starting bleeding like it was water coming out of the faucet. I had an iud put in and I recently had an abortion... should I worry ""}",,true
"2020-01-09T21:38:35.117Z","One of the possible side effects of an IUD is spotting or bleeding between periods. If you just got the IUD a couple months ago, it’s normal and it's just your body adjusting. If after a couple months you’re still having issues, talk to your doctor to see if maybe something else is going on.","{""payloadJson"":{""output"":{""generic"":[{""response_type"":""text"",""text"":""One of the possible side effects of an IUD is spotting or bleeding between periods. If you just got the IUD a couple months ago, it’s normal and it's just your body adjusting. If after a couple months you’re still having issues, talk to your doctor to see if maybe something else is going on.""},{""typing"":true,""response_type"":""pause"",""time"":1700},{""response_type"":""text"",""text"":""<a href=\""/#birth-control-finder\"">Tap here to scroll to a list of docs who can help you with your IUD.</a>""},{""response_type"":""text"",""text"":""Or, you can ask me a different question.""}],""nodes_visited"":[""node_37_1534978037125"",""node_12_1542218276883""],""text"":[""One of the possible side effects of an IUD is spotting or bleeding between periods. If you just got the IUD a couple months ago, it’s normal and it's just your body adjusting. If after a couple months you’re still having issues, talk to your doctor to see if maybe something else is going on."",""<a href=\""/#birth-control-finder\"">Tap here to scroll to a list of docs who can help you with your IUD.</a>"",""Or, you can ask me a different question.""]},""context"":{""bot_lang"":""layla"",""metadata"":{""user_id"":""928993ef-a982-4282-8082-fcf9b5704e2b""},""system"":{""dialog_request_counter"":2,""dialog_stack"":[{""dialog_node"":""root""}],""dialog_turn_counter"":2,""_node_output_map"":{""node_2_1541089898852"":{""0"":[0],""2"":[0]},""node_12_1542218276883"":{""0"":[0],""2"":[0],""3"":[0]}},""initialized"":true,""branch_exited"":true,""branch_exited_reason"":""completed""},""bot_mode"":""web"",""conversation_id"":""8673f00b-ad03-4fe5-afb9-5aacad125541""},""input"":{""text"":""Today I starting bleeding like it was water coming out of the faucet. I had an iud put in and I recently had an abortion... should I worry ""},""intents"":[{""intent"":""IUD.bleeding.at.first"",""confidence"":0.2218950511474418}],""entities"":[{""location"":[79,82],""value"":""IUD"",""entity"":""Birth_Control"",""confidence"":1},{""location"":[112,120],""value"":""abortion"",""entity"":""Abortion"",""confidence"":1}],""alternate_intents"":false},""text"":""One of the possible side effects of an IUD is spotting or bleeding between periods. If you just got the IUD a couple months ago, it’s normal and it's just your body adjusting. If after a couple months you’re still having issues, talk to your doctor to see if maybe something else is going on."",""userId"":""928993ef-a982-4282-8082-fcf9b5704e2b"",""intent"":{""name"":""IUD.bleeding.at.first"",""inputs"":[{""name"":""Birth_Control"",""value"":""IUD""},{""name"":""Abortion"",""value"":""abortion""}]}}","IUD.bleeding.at.first",false
"2020-01-09T21:38:36.080Z","e1eb36b0-040d-4fdd-843d-ccde7dc6a3c8","{""userId"":""928993ef-a982-4282-8082-fcf9b5704e2b"",""text"":""e1eb36b0-040d-4fdd-843d-ccde7dc6a3c8""}",,true
"2020-01-09T21:38:36.098Z","I'm sorry can you ask that some other way?","{""payloadJson"":{""output"":{""generic"":[{""response_type"":""text"",""text"":""I'm sorry can you ask that some other way?""}],""nodes_visited"":[""node_1_1540844990941""],""text"":[""I'm sorry can you ask that some other way?""]},""context"":{""bot_lang"":""layla"",""metadata"":{""user_id"":""928993ef-a982-4282-8082-fcf9b5704e2b""},""system"":{""dialog_request_counter"":3,""dialog_stack"":[{""dialog_node"":""root""}],""dialog_turn_counter"":3,""_node_output_map"":{""node_1_1540844990941"":{""0"":[0]},""node_2_1541089898852"":{""0"":[0],""2"":[0]},""node_12_1542218276883"":{""0"":[0],""2"":[0],""3"":[0]}},""initialized"":true,""branch_exited"":true,""branch_exited_reason"":""completed""},""bot_mode"":""web"",""conversation_id"":""8673f00b-ad03-4fe5-afb9-5aacad125541""},""input"":{""text"":""e1eb36b0-040d-4fdd-843d-ccde7dc6a3c8""},""intents"":[{""intent"":""unknown"",""confidence"":1}],""alternate_intents"":false},""text"":""I'm sorry can you ask that some other way?"",""userId"":""928993ef-a982-4282-8082-fcf9b5704e2b"",""intent"":{""name"":""unknown""}}","unknown",false
"2020-01-09T21:38:45.187Z",,"{""userId"":""928993ef-a982-4282-8082-fcf9b5704e2b""}",,true
"2020-01-09T21:38:45.186Z","<div class=""avatar-container""><img src=""https://laylasgotyou.com/assets/images/layla-avatar.png"" alt=""layla"" /></div>","{""userId"":""928993ef-a982-4282-8082-fcf9b5704e2b"",""payloadJson"":{""output"":{""generic"":[{""response_type"":""text"",""text"":""<div class=\""avatar-container\""><img src=\""https://laylasgotyou.com/assets/images/layla-avatar.png\"" alt=\""layla\"" /></div>""},{""typing"":true,""response_type"":""pause"",""time"":1500},{""response_type"":""text"",""text"":""Hey girl! I’m Layla. Consider me your new best friend with all the deets about those uncomfortable topics like birth control, sex, and STDs. You know, the stuff you’re not exactly running home to talk to mom about. Ask me anything you want and I promise, it stays between me and you. Have any questions for me? I’m listening!""}],""nodes_visited"":[""Welcome"",""node_2_1541089898852""],""text"":[""<div class=\""avatar-container\""><img src=\""https://laylasgotyou.com/assets/images/layla-avatar.png\"" alt=\""layla\"" /></div>"",""Hey girl! I’m Layla. Consider me your new best friend with all the deets about those uncomfortable topics like birth control, sex, and STDs. You know, the stuff you’re not exactly running home to talk to mom about. Ask me anything you want and I promise, it stays between me and you. Have any questions for me? I’m listening!""]},""context"":{""bot_lang"":""layla"",""metadata"":{""user_id"":""928993ef-a982-4282-8082-fcf9b5704e2b""},""system"":{""dialog_request_counter"":1,""dialog_stack"":[{""dialog_node"":""root""}],""dialog_turn_counter"":1,""_node_output_map"":{""node_2_1541089898852"":{""0"":[0],""2"":[0]}},""initialized"":true,""branch_exited"":true,""branch_exited_reason"":""completed""},""bot_mode"":""web"",""conversation_id"":""7e3b500b-9bb0-48ec-9cae-85a7bece5ce0""},""alternate_intents"":false},""text"":""<div class=\""avatar-container\""><img src=\""https://laylasgotyou.com/assets/images/layla-avatar.png\"" alt=\""layla\"" /></div>""}",,false