"Date","Text","Message JSON","Intent","Incoming"
"2020-01-17T02:44:31.223Z",,"{""userId"":""951a5044-6fbf-487a-9c49-76a78ed81cba""}",,true
"2020-01-17T02:44:31.224Z","<div class=""avatar-container""><img src=""https://laylasgotyou.com/assets/images/layla-avatar.png"" alt=""layla"" /></div>","{""userId"":""951a5044-6fbf-487a-9c49-76a78ed81cba"",""payloadJson"":{""output"":{""generic"":[{""response_type"":""text"",""text"":""<div class=\""avatar-container\""><img src=\""https://laylasgotyou.com/assets/images/layla-avatar.png\"" alt=\""layla\"" /></div>""},{""typing"":true,""response_type"":""pause"",""time"":1500},{""response_type"":""text"",""text"":""Hey girl! I’m Layla. Consider me your new best friend with all the deets about those uncomfortable topics like birth control, sex, and STDs. You know, the stuff you’re not exactly running home to talk to mom about. Ask me anything you want and I promise, it stays between me and you. Have any questions for me? I’m listening!""}],""nodes_visited"":[""Welcome"",""node_2_1541089898852""],""text"":[""<div class=\""avatar-container\""><img src=\""https://laylasgotyou.com/assets/images/layla-avatar.png\"" alt=\""layla\"" /></div>"",""Hey girl! I’m Layla. Consider me your new best friend with all the deets about those uncomfortable topics like birth control, sex, and STDs. You know, the stuff you’re not exactly running home to talk to mom about. Ask me anything you want and I promise, it stays between me and you. Have any questions for me? I’m listening!""]},""context"":{""bot_lang"":""layla"",""metadata"":{""user_id"":""951a5044-6fbf-487a-9c49-76a78ed81cba""},""system"":{""dialog_request_counter"":1,""dialog_stack"":[{""dialog_node"":""root""}],""dialog_turn_counter"":1,""_node_output_map"":{""node_2_1541089898852"":{""0"":[0],""2"":[0]}},""initialized"":true,""branch_exited"":true,""branch_exited_reason"":""completed""},""bot_mode"":""web"",""conversation_id"":""8fba9e5f-7964-456f-abcb-0e6ebf11750a""},""alternate_intents"":false},""text"":""<div class=\""avatar-container\""><img src=\""https://laylasgotyou.com/assets/images/layla-avatar.png\"" alt=\""layla\"" /></div>""}",,false
"2020-01-17T02:44:56.212Z","I’ve been trying for 9 months why am I not pregnant?? ","{""userId"":""951a5044-6fbf-487a-9c49-76a78ed81cba"",""text"":""I’ve been trying for 9 months why am I not pregnant?? ""}",,true
"2020-01-17T02:44:56.527Z","e1eb36b0-040d-4fdd-843d-ccde7dc6a3c8","{""userId"":""951a5044-6fbf-487a-9c49-76a78ed81cba"",""text"":""e1eb36b0-040d-4fdd-843d-ccde7dc6a3c8""}",,true
"2020-01-17T02:44:56.197Z","Finding out your pregnant can be scary af, especially if this wasn’t in the plans. You could be pregnant if your period’s late, your boobs hurt, or you feel sick to your stomach. ","{""payloadJson"":{""output"":{""generic"":[{""response_type"":""text"",""text"":""Finding out your pregnant can be scary af, especially if this wasn’t in the plans. You could be pregnant if your period’s late, your boobs hurt, or you feel sick to your stomach. ""},{""response_type"":""text"",""text"":""If you miss your period, you should take a pregnancy test ASAP. You can get them pretty much at any grocery store or pharmacy and you don’t have to be 18 or have your parent’s permission. If you ARE pregnant, take a deep breath and know that you have options. There are a lot of people who can help you right now.""},{""response_type"":""text"",""text"":""Make that doctor’s appointment ASAP to figure out the next best move for YOU. Check out <a target=\""_blank\"" href=\""https://www.plannedparenthood.org/health-center/new-york/syracuse/13210/syracuse-health-center-2471-91040/\"">Planned Parenthood</a> or <a target=\""_blank\"" href=\""http://www.smnfswcc.org/family-planning.aspx\"">Family Planning Service</a> if you're not sure where to go. ""}],""nodes_visited"":[""node_15_1534542928376"",""node_11_1541715692703""],""text"":[""Finding out your pregnant can be scary af, especially if this wasn’t in the plans. You could be pregnant if your period’s late, your boobs hurt, or you feel sick to your stomach. "",""If you miss your period, you should take a pregnancy test ASAP. You can get them pretty much at any grocery store or pharmacy and you don’t have to be 18 or have your parent’s permission. If you ARE pregnant, take a deep breath and know that you have options. There are a lot of people who can help you right now."",""Make that doctor’s appointment ASAP to figure out the next best move for YOU. Check out <a target=\""_blank\"" href=\""https://www.plannedparenthood.org/health-center/new-york/syracuse/13210/syracuse-health-center-2471-91040/\"">Planned Parenthood</a> or <a target=\""_blank\"" href=\""http://www.smnfswcc.org/family-planning.aspx\"">Family Planning Service</a> if you're not sure where to go. ""]},""context"":{""bot_lang"":""layla"",""metadata"":{""user_id"":""951a5044-6fbf-487a-9c49-76a78ed81cba""},""system"":{""dialog_request_counter"":2,""dialog_stack"":[{""dialog_node"":""root""}],""dialog_turn_counter"":2,""_node_output_map"":{""node_11_1541715692703"":{""0"":[0],""1"":[0],""2"":[0]},""node_2_1541089898852"":{""0"":[0],""2"":[0]}},""initialized"":true,""branch_exited"":true,""branch_exited_reason"":""completed""},""bot_mode"":""web"",""conversation_id"":""8fba9e5f-7964-456f-abcb-0e6ebf11750a""},""input"":{""text"":""I’ve been trying for 9 months why am I not pregnant?? ""},""intents"":[{""intent"":""Preg.know"",""confidence"":0.4257621765136719}],""entities"":[{""location"":[21,22],""metadata"":{""numeric_value"":9},""value"":""9"",""entity"":""sys-number"",""confidence"":1},{""location"":[43,51],""value"":""pregnant"",""entity"":""Pregnant"",""confidence"":1}],""alternate_intents"":false},""text"":""Finding out your pregnant can be scary af, especially if this wasn’t in the plans. You could be pregnant if your period’s late, your boobs hurt, or you feel sick to your stomach. "",""userId"":""951a5044-6fbf-487a-9c49-76a78ed81cba"",""intent"":{""name"":""Preg.know"",""inputs"":[{""name"":""sys-number"",""value"":""9""},{""name"":""Pregnant"",""value"":""pregnant""}]}}","Preg.know",false
"2020-01-17T02:44:56.539Z","I'm sorry can you ask that some other way?","{""payloadJson"":{""output"":{""generic"":[{""response_type"":""text"",""text"":""I'm sorry can you ask that some other way?""}],""nodes_visited"":[""node_1_1540844990941""],""text"":[""I'm sorry can you ask that some other way?""]},""context"":{""bot_lang"":""layla"",""metadata"":{""user_id"":""951a5044-6fbf-487a-9c49-76a78ed81cba""},""system"":{""dialog_request_counter"":3,""dialog_stack"":[{""dialog_node"":""root""}],""dialog_turn_counter"":3,""_node_output_map"":{""node_11_1541715692703"":{""0"":[0],""1"":[0],""2"":[0]},""node_1_1540844990941"":{""0"":[0]},""node_2_1541089898852"":{""0"":[0],""2"":[0]}},""initialized"":true,""branch_exited"":true,""branch_exited_reason"":""completed""},""bot_mode"":""web"",""conversation_id"":""8fba9e5f-7964-456f-abcb-0e6ebf11750a""},""input"":{""text"":""e1eb36b0-040d-4fdd-843d-ccde7dc6a3c8""},""intents"":[{""intent"":""unknown"",""confidence"":1}],""alternate_intents"":false},""text"":""I'm sorry can you ask that some other way?"",""userId"":""951a5044-6fbf-487a-9c49-76a78ed81cba"",""intent"":{""name"":""unknown""}}","unknown",false
"2020-01-17T02:45:08.991Z","Pregnancy happens when sperm from a guy’s semen connects with a woman’s egg and that egg sticks itself to the side of that woman’s uterus. This is the only way. Grinding, kissing, and even oral sex can’t get you pregnant.","{""payloadJson"":{""output"":{""generic"":[{""response_type"":""text"",""text"":""Pregnancy happens when sperm from a guy’s semen connects with a woman’s egg and that egg sticks itself to the side of that woman’s uterus. This is the only way. Grinding, kissing, and even oral sex can’t get you pregnant.""}],""nodes_visited"":[""node_10_1534788073260"",""node_17_1541716012364""],""text"":[""Pregnancy happens when sperm from a guy’s semen connects with a woman’s egg and that egg sticks itself to the side of that woman’s uterus. This is the only way. Grinding, kissing, and even oral sex can’t get you pregnant.""]},""context"":{""bot_lang"":""layla"",""metadata"":{""user_id"":""951a5044-6fbf-487a-9c49-76a78ed81cba""},""system"":{""dialog_request_counter"":4,""dialog_stack"":[{""dialog_node"":""root""}],""dialog_turn_counter"":4,""_node_output_map"":{""node_17_1541716012364"":{""0"":[0,0]},""node_11_1541715692703"":{""0"":[0],""1"":[0],""2"":[0]},""node_1_1540844990941"":{""0"":[0]},""node_2_1541089898852"":{""0"":[0],""2"":[0]}},""initialized"":true,""branch_exited"":true,""branch_exited_reason"":""completed""},""bot_mode"":""web"",""conversation_id"":""8fba9e5f-7964-456f-abcb-0e6ebf11750a""},""input"":{""text"":""How to get pregnant?""},""intents"":[{""intent"":""Preg.how"",""confidence"":0.6656956195831298}],""entities"":[{""location"":[11,19],""value"":""pregnant"",""entity"":""Pregnant"",""confidence"":1}],""alternate_intents"":false},""text"":""Pregnancy happens when sperm from a guy’s semen connects with a woman’s egg and that egg sticks itself to the side of that woman’s uterus. This is the only way. Grinding, kissing, and even oral sex can’t get you pregnant."",""userId"":""951a5044-6fbf-487a-9c49-76a78ed81cba"",""intent"":{""name"":""Preg.how"",""inputs"":[{""name"":""Pregnant"",""value"":""pregnant""}]}}","Preg.how",false
"2020-01-17T02:45:09.005Z","How to get pregnant?","{""userId"":""951a5044-6fbf-487a-9c49-76a78ed81cba"",""text"":""How to get pregnant?""}",,true