"Date","Text","Message JSON","Intent","Incoming"
"2020-01-02T19:38:02.666Z",,"{""userId"":""96998907-ac76-425f-81ee-a7789a570b47""}",,true
"2020-01-02T19:38:02.666Z","<div class=""avatar-container""><img src=""https://laylasgotyou.com/assets/images/layla-avatar.png"" alt=""layla"" /></div>","{""userId"":""96998907-ac76-425f-81ee-a7789a570b47"",""payloadJson"":{""output"":{""generic"":[{""response_type"":""text"",""text"":""<div class=\""avatar-container\""><img src=\""https://laylasgotyou.com/assets/images/layla-avatar.png\"" alt=\""layla\"" /></div>""},{""typing"":true,""response_type"":""pause"",""time"":1500},{""response_type"":""text"",""text"":""Hey girl! I’m Layla. Consider me your new best friend with all the deets about those uncomfortable topics like birth control, sex, and STDs. You know, the stuff you’re not exactly running home to talk to mom about. Ask me anything you want and I promise, it stays between me and you. Have any questions for me? I’m listening!""}],""nodes_visited"":[""Welcome"",""node_2_1541089898852""],""text"":[""<div class=\""avatar-container\""><img src=\""https://laylasgotyou.com/assets/images/layla-avatar.png\"" alt=\""layla\"" /></div>"",""Hey girl! I’m Layla. Consider me your new best friend with all the deets about those uncomfortable topics like birth control, sex, and STDs. You know, the stuff you’re not exactly running home to talk to mom about. Ask me anything you want and I promise, it stays between me and you. Have any questions for me? I’m listening!""]},""context"":{""bot_lang"":""layla"",""metadata"":{""user_id"":""96998907-ac76-425f-81ee-a7789a570b47""},""system"":{""dialog_request_counter"":1,""dialog_stack"":[{""dialog_node"":""root""}],""dialog_turn_counter"":1,""_node_output_map"":{""node_2_1541089898852"":{""0"":[0],""2"":[0]}},""initialized"":true,""branch_exited"":true,""branch_exited_reason"":""completed""},""bot_mode"":""web"",""conversation_id"":""c0853b65-50d7-4c14-a53c-8836781f3c4b""},""alternate_intents"":false},""text"":""<div class=\""avatar-container\""><img src=\""https://laylasgotyou.com/assets/images/layla-avatar.png\"" alt=\""layla\"" /></div>""}",,false
"2020-01-02T19:38:05.862Z","is the iud dangerous","{""userId"":""96998907-ac76-425f-81ee-a7789a570b47"",""text"":""is the iud dangerous""}",,true
"2020-01-02T19:38:05.847Z","All the IUDs are safe for most women. And the side effects of the IUD aren’t anything crazy either, just some cramping and spotting that will go away in a couple months. The best part though is that you’re protected against pregnancy and don’t have to worry about it…for YEARS! 🙏🏽","{""payloadJson"":{""output"":{""generic"":[{""response_type"":""text"",""text"":""All the IUDs are safe for most women. And the side effects of the IUD aren’t anything crazy either, just some cramping and spotting that will go away in a couple months. The best part though is that you’re protected against pregnancy and don’t have to worry about it…for YEARS! 🙏🏽""},{""typing"":true,""response_type"":""pause"",""time"":2100},{""options"":[{""value"":{""input"":{""text"":""What are the different types of IUDs?""}},""label"":""Read about the different types of IUDs here.""}],""response_type"":""option""},{""response_type"":""text"",""text"":""Or, you can ask me something else too.""}],""nodes_visited"":[""node_14_1534960369532"",""node_62_1542149758024""],""text"":[""All the IUDs are safe for most women. And the side effects of the IUD aren’t anything crazy either, just some cramping and spotting that will go away in a couple months. The best part though is that you’re protected against pregnancy and don’t have to worry about it…for YEARS! 🙏🏽"",""Or, you can ask me something else too.""]},""context"":{""bot_lang"":""layla"",""metadata"":{""user_id"":""96998907-ac76-425f-81ee-a7789a570b47""},""system"":{""dialog_request_counter"":2,""dialog_stack"":[{""dialog_node"":""root""}],""dialog_turn_counter"":2,""_node_output_map"":{""node_2_1541089898852"":{""0"":[0],""2"":[0]},""node_62_1542149758024"":{""0"":[0],""3"":[0]}},""initialized"":true,""branch_exited"":true,""branch_exited_reason"":""completed""},""bot_mode"":""web"",""conversation_id"":""c0853b65-50d7-4c14-a53c-8836781f3c4b""},""input"":{""text"":""is the iud dangerous""},""intents"":[{""intent"":""IUD.safe"",""confidence"":1}],""entities"":[{""location"":[7,10],""value"":""IUD"",""entity"":""Birth_Control"",""confidence"":1}],""alternate_intents"":false},""text"":""All the IUDs are safe for most women. And the side effects of the IUD aren’t anything crazy either, just some cramping and spotting that will go away in a couple months. The best part though is that you’re protected against pregnancy and don’t have to worry about it…for YEARS! 🙏🏽"",""userId"":""96998907-ac76-425f-81ee-a7789a570b47"",""intent"":{""name"":""IUD.safe"",""inputs"":[{""name"":""Birth_Control"",""value"":""IUD""}]}}","IUD.safe",false
"2020-01-02T19:38:13.033Z","What are the different types of IUDs?","{""userId"":""96998907-ac76-425f-81ee-a7789a570b47"",""text"":""What are the different types of IUDs?""}",,true
"2020-01-02T19:38:13.051Z","There are a few different types of IUDs, and they're all pretty popular. There are four IUDs with hormones (Mirena, Skyla, Liletta, and Kyleena), and one without hormones (ParaGard). ","{""payloadJson"":{""output"":{""generic"":[{""response_type"":""text"",""text"":""There are a few different types of IUDs, and they're all pretty popular. There are four IUDs with hormones (Mirena, Skyla, Liletta, and Kyleena), and one without hormones (ParaGard). ""},{""response_type"":""text"",""text"":""They all prevent pregnancy, so talk to a doctor about which one is best for you. ""},{""typing"":true,""response_type"":""pause"",""time"":2100},{""options"":[{""value"":{""input"":{""text"":""How effective is the IUD?""}},""label"":""Tap here to see how effective the IUD is at preventing pregnancy""}],""response_type"":""option""},{""response_type"":""text"",""text"":""Or, ask me something else.""}],""nodes_visited"":[""node_16_1535394655726"",""node_5_1544228418466""],""text"":[""There are a few different types of IUDs, and they're all pretty popular. There are four IUDs with hormones (Mirena, Skyla, Liletta, and Kyleena), and one without hormones (ParaGard). "",""They all prevent pregnancy, so talk to a doctor about which one is best for you. "",""Or, ask me something else.""]},""context"":{""bot_lang"":""layla"",""metadata"":{""user_id"":""96998907-ac76-425f-81ee-a7789a570b47""},""system"":{""dialog_request_counter"":3,""dialog_stack"":[{""dialog_node"":""root""}],""dialog_turn_counter"":3,""_node_output_map"":{""node_2_1541089898852"":{""0"":[0],""2"":[0]},""node_5_1544228418466"":{""0"":[0],""1"":[0],""4"":[0]},""node_62_1542149758024"":{""0"":[0],""3"":[0]}},""initialized"":true,""branch_exited"":true,""branch_exited_reason"":""completed""},""bot_mode"":""web"",""conversation_id"":""c0853b65-50d7-4c14-a53c-8836781f3c4b""},""input"":{""text"":""What are the different types of IUDs?""},""intents"":[{""intent"":""IUD.types"",""confidence"":1}],""entities"":[{""location"":[32,36],""value"":""IUD"",""entity"":""Birth_Control"",""confidence"":1}],""alternate_intents"":false},""text"":""There are a few different types of IUDs, and they're all pretty popular. There are four IUDs with hormones (Mirena, Skyla, Liletta, and Kyleena), and one without hormones (ParaGard). "",""userId"":""96998907-ac76-425f-81ee-a7789a570b47"",""intent"":{""name"":""IUD.types"",""inputs"":[{""name"":""Birth_Control"",""value"":""IUD""}]}}","IUD.types",false
"2020-01-02T19:38:23.868Z","How effective is the IUD?","{""userId"":""96998907-ac76-425f-81ee-a7789a570b47"",""text"":""How effective is the IUD?""}",,true
"2020-01-02T19:38:23.857Z","The IUD is a great birth control option for women who don’t want to deal with having to take a pill every day or think about switching patches or rings. It takes a few minutes to put in and then you’re protected for all day, every day for YEARS. ","{""payloadJson"":{""output"":{""generic"":[{""response_type"":""text"",""text"":""The IUD is a great birth control option for women who don’t want to deal with having to take a pill every day or think about switching patches or rings. It takes a few minutes to put in and then you’re protected for all day, every day for YEARS. ""},{""response_type"":""text"",""text"":""AND, it’s one of the most effective types of birth control. I mean, it’s 99% effective so out of 100 women, only 1 will get pregnant.""},{""typing"":true,""response_type"":""pause"",""time"":2500},{""response_type"":""text"",""text"":""<a href=\""/#birth-control-finder\"">To scroll to a list of clinics closest to you where you can get the IUD, tap here.</a>""},{""response_type"":""text"",""text"":""Or, ask me another question.""}],""nodes_visited"":[""node_17_1534962999941"",""node_2_1542215724144""],""text"":[""The IUD is a great birth control option for women who don’t want to deal with having to take a pill every day or think about switching patches or rings. It takes a few minutes to put in and then you’re protected for all day, every day for YEARS. "",""AND, it’s one of the most effective types of birth control. I mean, it’s 99% effective so out of 100 women, only 1 will get pregnant."",""<a href=\""/#birth-control-finder\"">To scroll to a list of clinics closest to you where you can get the IUD, tap here.</a>"",""Or, ask me another question.""]},""context"":{""bot_lang"":""layla"",""metadata"":{""user_id"":""96998907-ac76-425f-81ee-a7789a570b47""},""system"":{""dialog_request_counter"":4,""dialog_stack"":[{""dialog_node"":""root""}],""dialog_turn_counter"":4,""_node_output_map"":{""node_2_1542215724144"":{""0"":[0],""1"":[0],""3"":[0],""4"":[0]},""node_2_1541089898852"":{""0"":[0],""2"":[0]},""node_5_1544228418466"":{""0"":[0],""1"":[0],""4"":[0]},""node_62_1542149758024"":{""0"":[0],""3"":[0]}},""initialized"":true,""branch_exited"":true,""branch_exited_reason"":""completed""},""bot_mode"":""web"",""conversation_id"":""c0853b65-50d7-4c14-a53c-8836781f3c4b""},""input"":{""text"":""How effective is the IUD?""},""intents"":[{""intent"":""IUD.efficacy"",""confidence"":1}],""entities"":[{""location"":[21,24],""value"":""IUD"",""entity"":""Birth_Control"",""confidence"":1}],""alternate_intents"":false},""text"":""The IUD is a great birth control option for women who don’t want to deal with having to take a pill every day or think about switching patches or rings. It takes a few minutes to put in and then you’re protected for all day, every day for YEARS. "",""userId"":""96998907-ac76-425f-81ee-a7789a570b47"",""intent"":{""name"":""IUD.efficacy"",""inputs"":[{""name"":""Birth_Control"",""value"":""IUD""}]}}","IUD.efficacy",false