2020-02-04T05:18:20.391Z,Can a penis go soft while intercourse without cuming,"You should always put on a condom when he's hard. If he gets soft after the condom is on (hey, it happens...), it's totally fine. Just make sure that when he gets hard again the condom is rolled down to the bottom of his penis and that you can still pinch a bit of space at the head of his penis. ",0.5484342813491822,205a5aec-19c1-43f7-9779-c8aed8ef1379
2020-02-04T05:19:18.052Z,Discharge after sex! ,"Our bodies are magical aren’t they 🙄? But, sometimes its hard to know what’s normal down there and what’s not. If you’ve noticed some wet stuff in your panties, that’s discharge. And guess what? ",0.5335212230682373,205a5aec-19c1-43f7-9779-c8aed8ef1379
2020-02-04T05:20:22.004Z,Does sperm come back out ,"Take your time, I'll be here whenever you want.  Layla's got you!",0.4926000595092774,205a5aec-19c1-43f7-9779-c8aed8ef1379
2020-02-04T05:20:22.283Z,e1eb36b0-040d-4fdd-843d-ccde7dc6a3c8,"I'm sorry can you ask that some other way?",1,205a5aec-19c1-43f7-9779-c8aed8ef1379
2020-02-04T05:20:50.214Z,How long does sperm live ,"Sperm are pretty strong and they LOVE a good warm, wet spot. That makes your body one of its favorite places - it can live up to 5 days inside you 😦. On surfaces like the bed or clothes, sperm doesn’t last very long and are dead within minutes.",0.9104615688323976,205a5aec-19c1-43f7-9779-c8aed8ef1379
2020-02-04T05:22:07.706Z,How many cells are in sperm ,"Sperm are pretty strong and they LOVE a good warm, wet spot. That makes your body one of its favorite places - it can live up to 5 days inside you 😦. On surfaces like the bed or clothes, sperm doesn’t last very long and are dead within minutes.",0.3545231103897095,205a5aec-19c1-43f7-9779-c8aed8ef1379
2020-02-04T05:22:08.142Z,e1eb36b0-040d-4fdd-843d-ccde7dc6a3c8,"I'm sorry can you ask that some other way?",1,205a5aec-19c1-43f7-9779-c8aed8ef1379
2020-02-04T05:22:56.295Z,How many sperm does one ejaculate at once ,Semen is the liquid that comes out of a man’s penis when he ejaculates or comes. Inside the semen is sperm and that’s what causes pregnancy and can spread STDs.,0.9772994518280029,205a5aec-19c1-43f7-9779-c8aed8ef1379
2020-02-04T05:24:11.609Z,How many babies does one ejaculate at once ,"Listen to me when I say this, strapping twice - wearing two condoms at once - is NEVER a good idea. Double the protection? NOPE. Using two condoms is actually MORE likely to make BOTH condoms break during sex. Trust me, one is enough!",0.6776752471923828,205a5aec-19c1-43f7-9779-c8aed8ef1379