"Date","Text","Message JSON","Intent","Incoming"
"2019-12-28T05:17:22.184Z",,"{""userId"":""6ff86581-c45c-4e6e-a295-c0f5453d8405""}",,true
"2019-12-28T05:17:22.184Z","<div class=""avatar-container""><img src=""https://laylasgotyou.com/assets/images/layla-avatar.png"" alt=""layla"" /></div>","{""userId"":""6ff86581-c45c-4e6e-a295-c0f5453d8405"",""payloadJson"":{""output"":{""generic"":[{""response_type"":""text"",""text"":""<div class=\""avatar-container\""><img src=\""https://laylasgotyou.com/assets/images/layla-avatar.png\"" alt=\""layla\"" /></div>""},{""typing"":true,""response_type"":""pause"",""time"":1500},{""response_type"":""text"",""text"":""Hey girl! I’m Layla. Consider me your new best friend with all the deets about those uncomfortable topics like birth control, sex, and STDs. You know, the stuff you’re not exactly running home to talk to mom about. Ask me anything you want and I promise, it stays between me and you. Have any questions for me? I’m listening!""}],""nodes_visited"":[""Welcome"",""node_2_1541089898852""],""text"":[""<div class=\""avatar-container\""><img src=\""https://laylasgotyou.com/assets/images/layla-avatar.png\"" alt=\""layla\"" /></div>"",""Hey girl! I’m Layla. Consider me your new best friend with all the deets about those uncomfortable topics like birth control, sex, and STDs. You know, the stuff you’re not exactly running home to talk to mom about. Ask me anything you want and I promise, it stays between me and you. Have any questions for me? I’m listening!""]},""context"":{""bot_lang"":""layla"",""metadata"":{""user_id"":""6ff86581-c45c-4e6e-a295-c0f5453d8405""},""system"":{""dialog_request_counter"":1,""dialog_stack"":[{""dialog_node"":""root""}],""dialog_turn_counter"":1,""_node_output_map"":{""node_2_1541089898852"":{""0"":[0],""2"":[0]}},""initialized"":true,""branch_exited"":true,""branch_exited_reason"":""completed""},""bot_mode"":""web"",""conversation_id"":""fbc38641-1dde-4ca1-84c8-05de8ca4f1c6""},""alternate_intents"":false},""text"":""<div class=\""avatar-container\""><img src=\""https://laylasgotyou.com/assets/images/layla-avatar.png\"" alt=\""layla\"" /></div>""}",,false
"2019-12-28T05:18:11.577Z","Why do we need to have sex ","{""userId"":""6ff86581-c45c-4e6e-a295-c0f5453d8405"",""text"":""Why do we need to have sex ""}",,true
"2019-12-28T05:18:11.590Z","There isn’t a “right” time to have sex. Sex is all about you. You have sex when YOU’RE ready to have sex. If you’re thinking you might be ready, it’s a good idea to start birth control. ","{""payloadJson"":{""output"":{""generic"":[{""response_type"":""text"",""text"":""There isn’t a “right” time to have sex. Sex is all about you. You have sex when YOU’RE ready to have sex. If you’re thinking you might be ready, it’s a good idea to start birth control. ""},{""response_type"":""text"",""text"":""That way you’re already covered when you start having sex because YES, you CAN get pregnant the first time.""},{""typing"":true,""response_type"":""pause"",""time"":2200},{""options"":[{""value"":{""input"":{""text"":""How do I choose the right kind of birth control?""}},""label"":""Tap here to learn about choosing the best birth control for you.""}],""response_type"":""option""},{""response_type"":""text"",""text"":""Or you can ask me another question.""}],""nodes_visited"":[""node_7_1535646904489"",""node_26_1541630799961""],""text"":[""There isn’t a “right” time to have sex. Sex is all about you. You have sex when YOU’RE ready to have sex. If you’re thinking you might be ready, it’s a good idea to start birth control. "",""That way you’re already covered when you start having sex because YES, you CAN get pregnant the first time."",""Or you can ask me another question.""]},""context"":{""bot_lang"":""layla"",""metadata"":{""user_id"":""6ff86581-c45c-4e6e-a295-c0f5453d8405""},""system"":{""dialog_request_counter"":3,""dialog_stack"":[{""dialog_node"":""root""}],""dialog_turn_counter"":3,""_node_output_map"":{""node_26_1541630799961"":{""0"":[0],""1"":[0],""4"":[0]},""node_2_1541089898852"":{""0"":[0],""2"":[0]},""node_4_1541090288675"":{""0"":[0]}},""initialized"":true,""branch_exited"":true,""branch_exited_reason"":""completed""},""bot_mode"":""web"",""conversation_id"":""fbc38641-1dde-4ca1-84c8-05de8ca4f1c6""},""input"":{""text"":""Why do we need to have sex ""},""intents"":[{""intent"":""Sex.when.start"",""confidence"":0.6277544021606445}],""entities"":[{""location"":[23,26],""value"":""sex"",""entity"":""Sex"",""confidence"":1}],""alternate_intents"":false},""text"":""There isn’t a “right” time to have sex. Sex is all about you. You have sex when YOU’RE ready to have sex. If you’re thinking you might be ready, it’s a good idea to start birth control. "",""userId"":""6ff86581-c45c-4e6e-a295-c0f5453d8405"",""intent"":{""name"":""Sex.when.start"",""inputs"":[{""name"":""Sex"",""value"":""sex""}]}}","Sex.when.start",false
"2019-12-28T05:19:22.347Z","Um if I have sex at first time than when am I going to have baby ","{""userId"":""6ff86581-c45c-4e6e-a295-c0f5453d8405"",""text"":""Um if I have sex at first time than when am I going to have baby ""}",,true
"2019-12-28T05:19:22.695Z","e1eb36b0-040d-4fdd-843d-ccde7dc6a3c8","{""userId"":""6ff86581-c45c-4e6e-a295-c0f5453d8405"",""text"":""e1eb36b0-040d-4fdd-843d-ccde7dc6a3c8""}",,true
"2019-12-28T05:19:22.347Z","There isn’t a “right” time to have sex. Sex is all about you. You have sex when YOU’RE ready to have sex. If you’re thinking you might be ready, it’s a good idea to start birth control. ","{""payloadJson"":{""output"":{""generic"":[{""response_type"":""text"",""text"":""There isn’t a “right” time to have sex. Sex is all about you. You have sex when YOU’RE ready to have sex. If you’re thinking you might be ready, it’s a good idea to start birth control. ""},{""response_type"":""text"",""text"":""That way you’re already covered when you start having sex because YES, you CAN get pregnant the first time.""},{""typing"":true,""response_type"":""pause"",""time"":2200},{""options"":[{""value"":{""input"":{""text"":""How do I choose the right kind of birth control?""}},""label"":""Tap here to learn about choosing the best birth control for you.""}],""response_type"":""option""},{""response_type"":""text"",""text"":""Or you can ask me another question.""}],""nodes_visited"":[""node_7_1535646904489"",""node_26_1541630799961""],""text"":[""There isn’t a “right” time to have sex. Sex is all about you. You have sex when YOU’RE ready to have sex. If you’re thinking you might be ready, it’s a good idea to start birth control. "",""That way you’re already covered when you start having sex because YES, you CAN get pregnant the first time."",""Or you can ask me another question.""]},""context"":{""bot_lang"":""layla"",""metadata"":{""user_id"":""6ff86581-c45c-4e6e-a295-c0f5453d8405""},""system"":{""dialog_request_counter"":4,""dialog_stack"":[{""dialog_node"":""root""}],""dialog_turn_counter"":4,""_node_output_map"":{""node_26_1541630799961"":{""0"":[0],""1"":[0],""4"":[0]},""node_2_1541089898852"":{""0"":[0],""2"":[0]},""node_4_1541090288675"":{""0"":[0]}},""initialized"":true,""branch_exited"":true,""branch_exited_reason"":""completed""},""bot_mode"":""web"",""conversation_id"":""fbc38641-1dde-4ca1-84c8-05de8ca4f1c6""},""input"":{""text"":""Um if I have sex at first time than when am I going to have baby ""},""intents"":[{""intent"":""Sex.when.start"",""confidence"":0.48629503250122075}],""entities"":[{""location"":[13,16],""value"":""sex"",""entity"":""Sex"",""confidence"":1}],""alternate_intents"":false},""text"":""There isn’t a “right” time to have sex. Sex is all about you. You have sex when YOU’RE ready to have sex. If you’re thinking you might be ready, it’s a good idea to start birth control. "",""userId"":""6ff86581-c45c-4e6e-a295-c0f5453d8405"",""intent"":{""name"":""Sex.when.start"",""inputs"":[{""name"":""Sex"",""value"":""sex""}]}}","Sex.when.start",false
"2019-12-28T05:19:22.679Z","I'm sorry can you ask that some other way?","{""payloadJson"":{""output"":{""generic"":[{""response_type"":""text"",""text"":""I'm sorry can you ask that some other way?""}],""nodes_visited"":[""node_1_1540844990941""],""text"":[""I'm sorry can you ask that some other way?""]},""context"":{""bot_lang"":""layla"",""metadata"":{""user_id"":""6ff86581-c45c-4e6e-a295-c0f5453d8405""},""system"":{""dialog_request_counter"":5,""dialog_stack"":[{""dialog_node"":""root""}],""dialog_turn_counter"":5,""_node_output_map"":{""node_26_1541630799961"":{""0"":[0],""1"":[0],""4"":[0]},""node_1_1540844990941"":{""0"":[0]},""node_2_1541089898852"":{""0"":[0],""2"":[0]},""node_4_1541090288675"":{""0"":[0]}},""initialized"":true,""branch_exited"":true,""branch_exited_reason"":""completed""},""bot_mode"":""web"",""conversation_id"":""fbc38641-1dde-4ca1-84c8-05de8ca4f1c6""},""input"":{""text"":""e1eb36b0-040d-4fdd-843d-ccde7dc6a3c8""},""intents"":[{""intent"":""unknown"",""confidence"":1}],""alternate_intents"":false},""text"":""I'm sorry can you ask that some other way?"",""userId"":""6ff86581-c45c-4e6e-a295-c0f5453d8405"",""intent"":{""name"":""unknown""}}","unknown",false