"Date","Text","Message JSON","Intent","Incoming"
"2019-12-04T18:14:34.561Z",,"{""userId"":""854166e3-cb58-47ba-8e52-f93b8745b56f""}",,true
"2019-12-04T18:14:34.566Z","<div class=""avatar-container""><img src=""https://laylasgotyou.com/assets/images/layla-avatar.png"" alt=""layla"" /></div>","{""userId"":""854166e3-cb58-47ba-8e52-f93b8745b56f"",""payloadJson"":{""output"":{""generic"":[{""response_type"":""text"",""text"":""<div class=\""avatar-container\""><img src=\""https://laylasgotyou.com/assets/images/layla-avatar.png\"" alt=\""layla\"" /></div>""},{""typing"":true,""response_type"":""pause"",""time"":1500},{""response_type"":""text"",""text"":""Hey girl! I’m Layla. Consider me your new best friend with all the deets about those uncomfortable topics like birth control, sex, and STDs. You know, the stuff you’re not exactly running home to talk to mom about. Ask me anything you want and I promise, it stays between me and you. Have any questions for me? I’m listening!""}],""nodes_visited"":[""Welcome"",""node_2_1541089898852""],""text"":[""<div class=\""avatar-container\""><img src=\""https://laylasgotyou.com/assets/images/layla-avatar.png\"" alt=\""layla\"" /></div>"",""Hey girl! I’m Layla. Consider me your new best friend with all the deets about those uncomfortable topics like birth control, sex, and STDs. You know, the stuff you’re not exactly running home to talk to mom about. Ask me anything you want and I promise, it stays between me and you. Have any questions for me? I’m listening!""]},""context"":{""bot_lang"":""layla"",""metadata"":{""user_id"":""854166e3-cb58-47ba-8e52-f93b8745b56f""},""system"":{""dialog_request_counter"":1,""dialog_stack"":[{""dialog_node"":""root""}],""dialog_turn_counter"":1,""_node_output_map"":{""node_2_1541089898852"":{""0"":[0],""2"":[0]}},""initialized"":true,""branch_exited"":true,""branch_exited_reason"":""completed""},""bot_mode"":""web"",""conversation_id"":""28d660fb-0aaf-4569-84b7-c7c87902012a""},""alternate_intents"":false},""text"":""<div class=\""avatar-container\""><img src=\""https://laylasgotyou.com/assets/images/layla-avatar.png\"" alt=\""layla\"" /></div>""}",,false
"2019-12-04T18:14:42.856Z","how do i talk to my partner about sex?","{""userId"":""854166e3-cb58-47ba-8e52-f93b8745b56f"",""text"":""how do i talk to my partner about sex?""}",,true
"2019-12-04T18:14:42.842Z","That awkward moment when your parents ask you about birth control and sex 😩. We’ve all been there. If you find yourself in that spot, try to explain to them that you’re trying to be responsible, that you want to have control of your body, or even that you’re having some issues with out of control periods and you heard birth control can help.","{""payloadJson"":{""output"":{""generic"":[{""response_type"":""text"",""text"":""That awkward moment when your parents ask you about birth control and sex 😩. We’ve all been there. If you find yourself in that spot, try to explain to them that you’re trying to be responsible, that you want to have control of your body, or even that you’re having some issues with out of control periods and you heard birth control can help.""},{""response_type"":""text"",""text"":""At the end of the day though, you don’t NEED your parent’s permission to get birth control. So if you’re ready to get started, check out <a target=\""_blank\"" href=\""https://www.plannedparenthood.org/health-center/new-york/syracuse/13210/syracuse-health-center-2471-91040/\"">Planned Parenthood</a> or <a target=\""_blank\"" href=\""http://www.smnfswcc.org/family-planning.aspx\"">Family Planning Service</a> to get what you need.  ""},{""typing"":true,""response_type"":""pause"",""time"":5000},{""response_type"":""text"",""text"":""<a href=\""/#birth-control-types\"">Tap here to go to a list of birth control options.</a>""}],""nodes_visited"":[""node_1_1535489017812"",""node_10_1542664760397"",""node_1_1539882404909"",""node_1_1544810991157""],""text"":[""That awkward moment when your parents ask you about birth control and sex 😩. We’ve all been there. If you find yourself in that spot, try to explain to them that you’re trying to be responsible, that you want to have control of your body, or even that you’re having some issues with out of control periods and you heard birth control can help."",""At the end of the day though, you don’t NEED your parent’s permission to get birth control. So if you’re ready to get started, check out <a target=\""_blank\"" href=\""https://www.plannedparenthood.org/health-center/new-york/syracuse/13210/syracuse-health-center-2471-91040/\"">Planned Parenthood</a> or <a target=\""_blank\"" href=\""http://www.smnfswcc.org/family-planning.aspx\"">Family Planning Service</a> to get what you need.  "",""<a href=\""/#birth-control-types\"">Tap here to go to a list of birth control options.</a>""]},""context"":{""bot_lang"":""layla"",""metadata"":{""user_id"":""854166e3-cb58-47ba-8e52-f93b8745b56f""},""system"":{""dialog_request_counter"":2,""dialog_stack"":[{""dialog_node"":""root""}],""dialog_turn_counter"":2,""_node_output_map"":{""node_2_1541089898852"":{""0"":[0],""2"":[0]},""node_10_1542664760397"":{""0"":[0],""1"":[0]},""node_1_1544810991157"":{""1"":[0,4,1,3,0,5,2,6]}},""initialized"":true,""branch_exited"":true,""branch_exited_reason"":""completed""},""bot_mode"":""web"",""conversation_id"":""28d660fb-0aaf-4569-84b7-c7c87902012a""},""input"":{""text"":""how do i talk to my partner about sex?""},""intents"":[{""intent"":""BC.how.to.tell.parents"",""confidence"":0.8182905673980714}],""entities"":[{""location"":[34,37],""value"":""sex"",""entity"":""Sex"",""confidence"":1}],""alternate_intents"":false},""text"":""That awkward moment when your parents ask you about birth control and sex 😩. We’ve all been there. If you find yourself in that spot, try to explain to them that you’re trying to be responsible, that you want to have control of your body, or even that you’re having some issues with out of control periods and you heard birth control can help."",""userId"":""854166e3-cb58-47ba-8e52-f93b8745b56f"",""intent"":{""name"":""BC.how.to.tell.parents"",""inputs"":[{""name"":""Sex"",""value"":""sex""}]}}","BC.how.to.tell.parents",false
"2019-12-04T18:14:59.992Z","how do i talk to my significant other about sex?","{""userId"":""854166e3-cb58-47ba-8e52-f93b8745b56f"",""text"":""how do i talk to my significant other about sex?""}",,true
"2019-12-04T18:15:00.009Z","That awkward moment when your parents ask you about birth control and sex 😩. We’ve all been there. If you find yourself in that spot, try to explain to them that you’re trying to be responsible, that you want to have control of your body, or even that you’re having some issues with out of control periods and you heard birth control can help.","{""payloadJson"":{""output"":{""generic"":[{""response_type"":""text"",""text"":""That awkward moment when your parents ask you about birth control and sex 😩. We’ve all been there. If you find yourself in that spot, try to explain to them that you’re trying to be responsible, that you want to have control of your body, or even that you’re having some issues with out of control periods and you heard birth control can help.""},{""response_type"":""text"",""text"":""At the end of the day though, you don’t NEED your parent’s permission to get birth control. So if you’re ready to get started, check out <a target=\""_blank\"" href=\""https://www.plannedparenthood.org/health-center/new-york/syracuse/13210/syracuse-health-center-2471-91040/\"">Planned Parenthood</a> or <a target=\""_blank\"" href=\""http://www.smnfswcc.org/family-planning.aspx\"">Family Planning Service</a> to get what you need.  ""},{""typing"":true,""response_type"":""pause"",""time"":5000},{""response_type"":""text"",""text"":""<a href=\""/#birth-control-types\"">Want more info on different birth control options? Tap here to scroll to a list of birth control options.</a> ""}],""nodes_visited"":[""node_1_1535489017812"",""node_10_1542664760397"",""node_1_1539882404909"",""node_1_1544810991157""],""text"":[""That awkward moment when your parents ask you about birth control and sex 😩. We’ve all been there. If you find yourself in that spot, try to explain to them that you’re trying to be responsible, that you want to have control of your body, or even that you’re having some issues with out of control periods and you heard birth control can help."",""At the end of the day though, you don’t NEED your parent’s permission to get birth control. So if you’re ready to get started, check out <a target=\""_blank\"" href=\""https://www.plannedparenthood.org/health-center/new-york/syracuse/13210/syracuse-health-center-2471-91040/\"">Planned Parenthood</a> or <a target=\""_blank\"" href=\""http://www.smnfswcc.org/family-planning.aspx\"">Family Planning Service</a> to get what you need.  "",""<a href=\""/#birth-control-types\"">Want more info on different birth control options? Tap here to scroll to a list of birth control options.</a> ""]},""context"":{""bot_lang"":""layla"",""metadata"":{""user_id"":""854166e3-cb58-47ba-8e52-f93b8745b56f""},""system"":{""dialog_request_counter"":3,""dialog_stack"":[{""dialog_node"":""root""}],""dialog_turn_counter"":3,""_node_output_map"":{""node_2_1541089898852"":{""0"":[0],""2"":[0]},""node_10_1542664760397"":{""0"":[0],""1"":[0]},""node_1_1544810991157"":{""1"":[1,4,1,3,0,5,2,6]}},""initialized"":true,""branch_exited"":true,""branch_exited_reason"":""completed""},""bot_mode"":""web"",""conversation_id"":""28d660fb-0aaf-4569-84b7-c7c87902012a""},""input"":{""text"":""how do i talk to my significant other about sex?""},""intents"":[{""intent"":""BC.how.to.tell.parents"",""confidence"":0.7297545433044434}],""entities"":[{""location"":[44,47],""value"":""sex"",""entity"":""Sex"",""confidence"":1}],""alternate_intents"":false},""text"":""That awkward moment when your parents ask you about birth control and sex 😩. We’ve all been there. If you find yourself in that spot, try to explain to them that you’re trying to be responsible, that you want to have control of your body, or even that you’re having some issues with out of control periods and you heard birth control can help."",""userId"":""854166e3-cb58-47ba-8e52-f93b8745b56f"",""intent"":{""name"":""BC.how.to.tell.parents"",""inputs"":[{""name"":""Sex"",""value"":""sex""}]}}","BC.how.to.tell.parents",false