"Date","Text","Message JSON","Intent","Incoming"
"2019-12-17T15:55:46.651Z",,"{""userId"":""fecb48fc-5d28-4575-b1c4-6c3971266786""}",,true
"2019-12-17T15:55:46.651Z","<div class=""avatar-container""><img src=""https://laylasgotyou.com/assets/images/layla-avatar.png"" alt=""layla"" /></div>","{""userId"":""fecb48fc-5d28-4575-b1c4-6c3971266786"",""payloadJson"":{""output"":{""generic"":[{""response_type"":""text"",""text"":""<div class=\""avatar-container\""><img src=\""https://laylasgotyou.com/assets/images/layla-avatar.png\"" alt=\""layla\"" /></div>""},{""typing"":true,""response_type"":""pause"",""time"":1500},{""response_type"":""text"",""text"":""Hey girl! I’m Layla. Consider me your new best friend with all the deets about those uncomfortable topics like birth control, sex, and STDs. You know, the stuff you’re not exactly running home to talk to mom about. Ask me anything you want and I promise, it stays between me and you. Have any questions for me? I’m listening!""}],""nodes_visited"":[""Welcome"",""node_2_1541089898852""],""text"":[""<div class=\""avatar-container\""><img src=\""https://laylasgotyou.com/assets/images/layla-avatar.png\"" alt=\""layla\"" /></div>"",""Hey girl! I’m Layla. Consider me your new best friend with all the deets about those uncomfortable topics like birth control, sex, and STDs. You know, the stuff you’re not exactly running home to talk to mom about. Ask me anything you want and I promise, it stays between me and you. Have any questions for me? I’m listening!""]},""context"":{""bot_lang"":""layla"",""metadata"":{""user_id"":""fecb48fc-5d28-4575-b1c4-6c3971266786""},""system"":{""dialog_request_counter"":1,""dialog_stack"":[{""dialog_node"":""root""}],""dialog_turn_counter"":1,""_node_output_map"":{""node_2_1541089898852"":{""0"":[0],""2"":[0]}},""initialized"":true,""branch_exited"":true,""branch_exited_reason"":""completed""},""bot_mode"":""web"",""conversation_id"":""71582d69-fec6-47da-9005-b7f02d4fcf9a""},""alternate_intents"":false},""text"":""<div class=\""avatar-container\""><img src=\""https://laylasgotyou.com/assets/images/layla-avatar.png\"" alt=\""layla\"" /></div>""}",,false
"2019-12-17T15:56:04.958Z","hello","{""userId"":""fecb48fc-5d28-4575-b1c4-6c3971266786"",""text"":""hello""}",,true
"2019-12-17T15:56:04.947Z","Heyyy girl! Have any questions about birth control? Just ask and I got you!","{""payloadJson"":{""output"":{""generic"":[{""response_type"":""text"",""text"":""Heyyy girl! Have any questions about birth control? Just ask and I got you!""}],""nodes_visited"":[""node_12_1539832480514"",""node_12_1542240270828""],""text"":[""Heyyy girl! Have any questions about birth control? Just ask and I got you!""]},""context"":{""bot_lang"":""layla"",""metadata"":{""user_id"":""fecb48fc-5d28-4575-b1c4-6c3971266786""},""system"":{""dialog_request_counter"":2,""dialog_stack"":[{""dialog_node"":""root""}],""dialog_turn_counter"":2,""_node_output_map"":{""node_2_1541089898852"":{""0"":[0],""2"":[0]},""node_12_1542240270828"":{""0"":[0,0]}},""initialized"":true,""branch_exited"":true,""branch_exited_reason"":""completed""},""bot_mode"":""web"",""conversation_id"":""71582d69-fec6-47da-9005-b7f02d4fcf9a""},""input"":{""text"":""hello""},""intents"":[{""intent"":""Hey"",""confidence"":0.8528146266937255}],""alternate_intents"":false},""text"":""Heyyy girl! Have any questions about birth control? Just ask and I got you!"",""userId"":""fecb48fc-5d28-4575-b1c4-6c3971266786"",""intent"":{""name"":""Hey""}}","Hey",false
"2019-12-17T15:56:20.758Z","what kinds of birth control are there? ","{""userId"":""fecb48fc-5d28-4575-b1c4-6c3971266786"",""text"":""what kinds of birth control are there? ""}",,true
"2019-12-17T15:56:20.774Z","Choosing the best birth control is a really personal decision. There are 18 different types to choose from and they each work differently. You have to use a condom every time you have sex, take the pill daily, get a new patch every week, change the ring every month, and the IUD or implant can last for years. ","{""payloadJson"":{""output"":{""generic"":[{""response_type"":""text"",""text"":""Choosing the best birth control is a really personal decision. There are 18 different types to choose from and they each work differently. You have to use a condom every time you have sex, take the pill daily, get a new patch every week, change the ring every month, and the IUD or implant can last for years. ""},{""response_type"":""text"",""text"":""What works for your best friend, might not be the best choice for you so it’s really important to know about your options and have a heart to heart with your doctor (and yourself).""},{""typing"":true,""response_type"":""pause"",""time"":5000},{""response_type"":""text"",""text"":""<a href=\""/#birth-control-types\"">Tap here to scroll to the different types of birth control.</a> ""}],""nodes_visited"":[""node_16_1534790514779"",""node_18_1541092071873"",""node_1_1539882404909"",""node_1_1544810991157""],""text"":[""Choosing the best birth control is a really personal decision. There are 18 different types to choose from and they each work differently. You have to use a condom every time you have sex, take the pill daily, get a new patch every week, change the ring every month, and the IUD or implant can last for years. "",""What works for your best friend, might not be the best choice for you so it’s really important to know about your options and have a heart to heart with your doctor (and yourself)."",""<a href=\""/#birth-control-types\"">Tap here to scroll to the different types of birth control.</a> ""]},""context"":{""bot_lang"":""layla"",""metadata"":{""user_id"":""fecb48fc-5d28-4575-b1c4-6c3971266786""},""system"":{""dialog_request_counter"":3,""dialog_stack"":[{""dialog_node"":""root""}],""dialog_turn_counter"":3,""_node_output_map"":{""node_1_1544810991157"":{""1"":[0,0,4,2,5,6,3,1]},""node_12_1542240270828"":{""0"":[0,0]},""node_2_1541089898852"":{""0"":[0],""2"":[0]},""node_18_1541092071873"":{""0"":[0],""1"":[0]}},""initialized"":true,""branch_exited"":true,""branch_exited_reason"":""completed""},""bot_mode"":""web"",""conversation_id"":""71582d69-fec6-47da-9005-b7f02d4fcf9a""},""input"":{""text"":""what kinds of birth control are there? ""},""intents"":[{""intent"":""BC.types"",""confidence"":0.9719733238220216}],""entities"":[{""location"":[14,27],""value"":""birth control"",""entity"":""Birth_Control"",""confidence"":1}],""alternate_intents"":false},""text"":""Choosing the best birth control is a really personal decision. There are 18 different types to choose from and they each work differently. You have to use a condom every time you have sex, take the pill daily, get a new patch every week, change the ring every month, and the IUD or implant can last for years. "",""userId"":""fecb48fc-5d28-4575-b1c4-6c3971266786"",""intent"":{""name"":""BC.types"",""inputs"":[{""name"":""Birth_Control"",""value"":""birth control""}]}}","BC.types",false